,id,questions,questions_perturbed,similarity_scores
977,36835,Wer wurde 2009 als neuer CIA-Chef von Barack Obama nominiert?,Wer wurde 2009 als neuer CIA-Chef von  Obama nominiert?,0.9937811
978,36836,Warum ist David Petraeus 2012 von seinem Amt zurückgetreten? , ist David Petraeus 2012 von seinem Amt zurückgetreten? ,0.9894528
979,36837,Wer wurde 2018 zum neuen Außenminister der USA ernannt? ,Wer wurde 2018 zum neuen Außenminister der USA ? ,0.9878865
980,36838,Wer ist derzeit der CIA-Chef?,Wer ist derzeit  CIA-Chef?,0.99259657
981,37034,Wann wurde über Sicherheitsrisiken von USB-Geräten berichtet?,Wann  über Sicherheitsrisiken von USB-Geräten berichtet?,0.98370826
982,37036,Welche Sicherheitsrisiken kann ein USB-Gerät haben?,Welche  kann ein USB-Gerät haben?,0.93768626
983,37039,Warum sind von einem USB-Stick ausgelöste  Virusangriffe schwer zu beheben?,Warum  von einem USB-Stick ausgelöste  Virusangriffe schwer zu beheben?,0.99244106
984,37041,Wie wird macOS gegen Virusangriffe geschützt?,Wie wird macOS  Virusangriffe geschützt?,0.97737056
985,37044,Warum hilft die Neuinstallation des Betriebssystems bei der Beseitigung von Malware nicht?,Warum  die Neuinstallation des Betriebssystems bei der Beseitigung von Malware nicht?,0.9844428
986,37045,Wer hat eine Lösung zur Schadensbehebung von Virusangriffen 2014 angekündigt?,Wer hat  Lösung zur Schadensbehebung von Virusangriffen 2014 angekündigt?,0.9971317
987,37046,Wo haben sich Denker in der Zeit der Aufklärung getroffen?,Wo haben sich Denker in der Zeit der Aufklärung ?,0.98351717
988,37047,Warum wurden während der Aufklärung in Deutschland Lesezirkel gebildet?,Warum wurden während der  in Deutschland Lesezirkel gebildet?,0.9898306
989,37048,Wie viele Lesegesellschaften gab es Ende des 18. Jahrhunderts in Deutschland?,Wie viele Lesegesellschaften gab es  des 18. Jahrhunderts in Deutschland?,0.9972887
990,37049,Welche literarische Formen zählten zu Hauptverbreitungsformen der Aufklärung?,Welche literarische Formen  zu Hauptverbreitungsformen der Aufklärung?,0.98559844
991,37050,In welchen Ländern bildete sich keine Salonkultur während der Aufklärung?,In welchen Ländern bildete sich keine Salonkultur während  Aufklärung?,0.9963672
992,37052,Welche Frauen waren aktiv während der Frühaufklärung in Deutschland?,Welche Frauen waren aktiv während der Frühaufklärung in ?,0.99562854
993,37655,Wie unterscheiden sich Ursäuger von anderen Säugetieren?,Wie  sich Ursäuger von anderen Säugetieren?,0.9749827
994,37657,Welcher Körperteil ist typisch für Ursäuger?,Welcher Körperteil ist  für Ursäuger?,0.9845385
995,37658,Wie sehen Eier von Ursäugern aus?,Wie sehen Eier von  aus?,0.9642379
996,37660,Wie sehen neugeschlüpfte Ursäuger aus?,Wie  neugeschlüpfte Ursäuger aus?,0.97420985
997,37663,In welcher Region lebt das Schnabeltier?,In welcher Region lebt  Schnabeltier?,0.9938411
998,38087,Welche Gruppe aus Italien ist bekannt in der Welt von Wrestling?,Welche Gruppe aus  ist bekannt in der Welt von Wrestling?,0.9871609
999,38088,Was ist die bekannteste italienische Wrestling-Liga?,Was ist die bekannteste  Wrestling-Liga?,0.9917277
1000,37721,Wo hat die WWE die Wrestling-Industrie expandiert?,Wo hat die WWE die -Industrie expandiert?,0.9878421
1001,38141,Was wird im Nahbereich einer Antenne erzeugt?,Was wird im Nahbereich einer  erzeugt?,0.97490454
1002,38273,Wann ist Wilhelm IV. gestorben?,Wann  Wilhelm IV. gestorben?,0.9729626
1003,38274,Welche Union endete mit der Thronübernahme durch Victoria?,Welche  endete mit der Thronübernahme durch Victoria?,0.99132776
1004,38275,Wann hat Victoria den Thron übernommen?,Wann hat  den Thron übernommen?,0.98509175
1005,38276,Wohin verlegte Victoria 1837 ihren Hofstaat?,Wohin verlegte Victoria  ihren Hofstaat?,0.98964685
1006,38278,Wann ist die Krönung von Victoria stattgefunden?,Wann ist  Krönung von Victoria stattgefunden?,0.98887813
1007,38279,Wie fand die Bevölkerung die Prinzessin Victoria?,Wie fand die Bevölkerung die Prinzessin ?,0.9903058
1008,38280,Welche Krone war speziell für Victoria angefertigt?,Welche Krone war speziell  Victoria angefertigt?,0.9841446
1009,38783,Warum ist es schwierig eine Definition von Gott aufzustellen?,Warum ist es schwierig eine  von Gott aufzustellen?,0.96601963
1010,38785,Von welchen Wesen wird Gott in einigen Kulturen nicht unterschieden?, welchen Wesen wird Gott in einigen Kulturen nicht unterschieden?,0.98160285
1011,38077,"Wie heißen politische Parteien, die die Arbeit freiwillig machen?","Wie heißen politische Parteien,   Arbeit freiwillig machen?",0.98227775
1012,38078,Was zeichnet eine Wählerpartei aus?,Was zeichnet  Wählerpartei aus?,0.9865604
1013,38079,Wie erfolgt die Finanzierung der Wählerparteien?,Wie erfolgt die Finanzierung  Wählerparteien?,0.9906945
1014,38080,Von wem wurden Wählerparteien gegründet?,Von wem wurden Wählerparteien ?,0.97398496
1015,38081,Anhänger welcher politischer Strömung waren die meisten Wählerparteien?,Anhänger welcher politischer Strömung waren die meisten ?,0.98144376
1016,38082,Wer hat die ersten Arbeiterparteien gegründet?,Wer  die ersten Arbeiterparteien gegründet?,0.98900694
1017,38083,Was zeichnet eine Mitgliederpartei aus?,Was zeichnet eine  aus?,0.93390834
1018,38084,Was sind Beispiele für Volksparteien in Deutschland?,Was sind Beispiele für  in Deutschland?,0.9621152
1019,38085,Was sind Beispiele für Volksparteien in Österreich?,Was sind Beispiele  Volksparteien in Österreich?,0.99184304
1020,38097,Aus welcher Sprache kommt Katalanisch?,Aus welcher  kommt Katalanisch?,0.94630206
1021,38098,Wann und wo wurde die katalanische Sprache zum ersten Mal erwähnt?,Wann und wo wurde die katalanische  zum ersten Mal erwähnt?,0.9949818
1022,38099,Aus welchem Jahrhundert stammen erste schriftliche Werke in der katalanischer Sprache?,Aus welchem Jahrhundert stammen erste schriftliche Werke in der  Sprache?,0.98370653
1023,38100,Wer hat die katalanische Sprache berühmt gemacht?,Wer hat die katalanische Sprache berühmt ?,0.98386896
1024,38101,Wann wurde die Sprachgrenze des Katalanischen festgelegt?,Wann wurde die Sprachgrenze  Katalanischen festgelegt?,0.9938426
1025,38102,Warum ist die katalanische Sprache zwischen dem 13. und 15. Jahrhundert bedeutend geworden?,Warum ist die katalanische Sprache zwischen  13. und 15. Jahrhundert bedeutend geworden?,0.9988321
1026,38103,Wann erschien das erste katalanische Wörterbuch?,Wann erschien das  katalanische Wörterbuch?,0.99414635
1027,38104,Welche andere Sprache beinhaltete das erste zweisprachige katalanische Wörterbuch?,Welche andere Sprache beinhaltete das  zweisprachige katalanische Wörterbuch?,0.994098
1028,38105,Wo kann man das erste katalanische Wörterbuch im Original finden?,Wo kann man das  katalanische Wörterbuch im Original finden?,0.99258155
1029,38106,Wer hatte das erste katalanische Wörterbuch hergestellt?,Wer hatte das erste katalanische  hergestellt?,0.9858011
1030,38107,Wodurch wurde die katalanische Sprache durch kastilische als Literatursprache verdrängt?,Wodurch wurde die  Sprache durch kastilische als Literatursprache verdrängt?,0.99433005
1031,38108,Wann hat der spanische Erbfolgekrieg stattgefunden?,Wann hat der spanische  stattgefunden?,0.9327492
1032,38109,Wann hat Katalonien seine politische Eigenständigkeit verloren?,Wann hat Katalonien  politische Eigenständigkeit verloren?,0.99096984
1033,38110,Wann ist die kastilische Sprache gesetzliche Unterrichtssprache geworden?,Wann ist die  Sprache gesetzliche Unterrichtssprache geworden?,0.97589225
1034,38111,Wie nennt man den Tiefpunkt der katalanischen Sprachgeschichte?,Wie nennt man den Tiefpunkt der  Sprachgeschichte?,0.9851868
1035,38112,Wann gewann das Katalanische nach seinem Tiefpunkt wieder an Bedeutung?, gewann das Katalanische nach seinem Tiefpunkt wieder an Bedeutung?,0.9881306
1036,38113,Wie nennt man die Wiedergeburt der katalanischer Sprache?,Wie nennt man die Wiedergeburt  katalanischer Sprache?,0.99683446
1037,38114,Wodurch wurde die Blüte des Katalanischen in den 1930er zerstört?,Wodurch wurde die Blüte des Katalanischen in den  zerstört?,0.98304737
1038,38115,Wie wurde die katalanische Sprache in den Anfangsjahren der Franco-Diktatur unterdrückt?,Wie wurde die katalanische Sprache in den  der Franco-Diktatur unterdrückt?,0.9871577
1039,38116,Wann ist der Diktator Franco gestorben?,Wann ist der  Franco gestorben?,0.96967554
1040,38117,Warum wird die katalanische Sprache seit den letzten 25 Jahren stark von der Regionalregierung gefördert?,Warum wird die katalanische Sprache seit den letzten 25 Jahren stark  der Regionalregierung gefördert?,0.9972592
1041,38118,Wie heißt der Prozess der Wiederherstellung der Bedeutung des Katalanischen?,Wie heißt  Prozess  Wiederherstellung  Bedeutung des Katalanischen?,0.97530323
1042,38119,Wie viel Prozent der in Katalonien lebenden Menschen können Spanisch schreiben?,Wie viel Prozent der in Katalonien lebenden Menschen  Spanisch schreiben?,0.9945932
1043,38120,Wie viel Prozent der katalanischen Bevölkerung können Katalanisch schreiben?, viel Prozent der katalanischen Bevölkerung können Katalanisch schreiben?,0.98735327
1044,38121,"Was ist der Beweis dafür, dass das Katalanische sich in den meisten Bereichen der Gesellschaft  durchgesetzt hat?","Was ist der Beweis , dass das Katalanische sich in den meisten Bereichen der Gesellschaft  durchgesetzt hat?",0.99798036
1045,38281,Wie haben die Medien das Osmanische Reich im letzten Drittel des 19. Jahrhundert bezeichnet?,Wie haben die Medien das Osmanische Reich im  Drittel des 19. Jahrhundert bezeichnet?,0.99800324
1046,38284,Welche historische Quellen von Hellenismus gibt es?,Welche historische Quellen von  gibt es?,0.946303
1047,38285,Warum sind fast keine schriftliche Werke aus der Zeit des Hellenismus erhalten?,Warum sind fast keine schriftliche  aus der Zeit des Hellenismus erhalten?,0.99286956
1048,38286,Welche Autoren aus dem Hellenismus sind fragmentarisch erhalten?,Welche  aus dem Hellenismus sind fragmentarisch erhalten?,0.9898454
1049,40407,Wann hat das Militär in Putschen die politische Macht übernommen?,Wann hat das Militär in Putschen die politische  übernommen?,0.9874417
1050,40408,Mit welchem Ereignis endete die Geschichte des Osmanischen Reiches?,Mit  Ereignis endete die Geschichte des Osmanischen Reiches?,0.9669589
1051,40411,"Wann hat das Osmanische Reich ein Heer gebildet, um die französische Armee aus Ägypten zu drängen?","Wann hat das Osmanische Reich ein Heer gebildet, um  französische Armee aus Ägypten zu drängen?",0.99854654
1052,40413,"Ab wann war es im Osmanischen Reich möglich, das Privateigentum zu besitzen?","Ab wann war es im Osmanischen Reich möglich, das  zu besitzen?",0.98951983
1053,40415,Wann besiegte die ägyptische Armee die osmanische in der Schlacht von Nisibis?, besiegte die ägyptische Armee die osmanische in der Schlacht von Nisibis?,0.9884205
1054,40416,Wann wurde das Sueskanal fertiggebaut?,Wann  das Sueskanal fertiggebaut?,0.9860633
1055,40417,"Was wurde in Ägypten im 19.Jahrhundert angebaut, das für Europa interessant war?","Was wurde in Ägypten im 19.Jahrhundert angebaut,  für Europa interessant war?",0.9883325
1056,40418,Was führte zu Aufständen am Ende des 19.Jahrhundert in Ägypten?,Was führte zu  am Ende des 19.Jahrhundert in Ägypten?,0.9915786
1057,40419,In welchem Jahr ist Ägypten der britische Schutzstaat geworden?,In welchem  ist Ägypten der britische Schutzstaat geworden?,0.9875759
1058,40421,Seit wann herrschte das Osmanische Reich über Ägypten?,Seit wann herrschte das Osmanische Reich über ?,0.98668045
1059,37688,In welche Teile wird North Carolina gegliedert?,In welche Teile  North Carolina gegliedert?,0.98337835
1060,37689,Wie sehen die Böden der atlantischen Küstenebene von North Carolina?,Wie sehen die Böden der  Küstenebene von North Carolina?,0.99370694
1061,37690,Wofür kann man die Böden der atlantischen Küstenebene von North Carolina verwenden?,Wofür kann man die Böden der atlantischen Küstenebene von  Carolina verwenden?,0.99862325
1062,37692,"Was ist ""Outer Banks"" in North Carolina?","Was ist ""Outer Banks"" in North ?",0.9927315
1063,37693,"Welche Lagunen umgeben die ""Outer Banks""?","Welche Lagunen umgeben  ""Outer Banks""?",0.99348485
1064,37694,Warum gibt es keinen bedeutenden Seehafen in North Carolina?,Warum gibt es keinen bedeutenden Seehafen in  Carolina?,0.9975216
1065,37695,Wie heißt der einzige größere Hafen von North Carolina?,Wie  der einzige größere Hafen von North Carolina?,0.9567756
1066,37696,Wie ist die geologische Struktur der atlantischen Küstenebene von North Carolina?,Wie ist die geologische Struktur  atlantischen Küstenebene von North Carolina?,0.9962878
1067,37698,Was zeichnet die Piedmont-Region von North Carolina aus?,Was zeichnet die Piedmont-Region von North Carolina ?,0.985956
1068,37699,Wie sieht die Landschaft der Piedmont-Region von North Carolina aus?,Wie sieht die Landschaft der Piedmont- von North Carolina aus?,0.9920468
1069,37701,Was ist die geologische Struktur der Piedmont-Region von North Carolina?,Was ist die geologische Struktur  Piedmont-Region von North Carolina?,0.99418396
1070,37703,In welchem Teil von North Carolina werden heutzutage verschiedene Baumaterialen abgebaut?,In welchem Teil von North Carolina werden heutzutage  Baumaterialen abgebaut?,0.99740994
1071,37705,Wie sehen die Böden in der Piedmont-Region von North Carolina aus?,Wie sehen die Böden in der Piedmont-Region von  Carolina aus?,0.9977533
1072,37706,Für welche Obstsorten ist die Piedmont-Region bekannt?, welche Obstsorten ist die Piedmont-Region bekannt?,0.98727065
1073,37707,Was bildet die Westgrenze von North Carolina?,Was bildet die Westgrenze  North Carolina?,0.9919573
1074,37708,Wie viele Bergzüge bilden die Berge auf dem Gebiet von North Carolina?,Wie  Bergzüge bilden die Berge auf dem Gebiet von North Carolina?,0.9891193
1075,37709,Was ist der größte Gebirgszug in North Carolina?,Was  der größte Gebirgszug in North Carolina?,0.988521
1076,37713,Wie werden die Great Smoky Mountains umgangssprachlich bezeichnet?,Wie werden die Great  Mountains umgangssprachlich bezeichnet?,0.98848814
1077,37714,Was ist der zweithöchste Gebirgszug in North Carolina?,Was  der zweithöchste Gebirgszug in North Carolina?,0.99111056
1078,37716,"Was ist der geologische Bestand vom ""Blue Ridge Belt""?","Was  der geologische Bestand vom ""Blue Ridge Belt""?",0.9921891
1079,37718,Was ist der älteste Gebirgszug North Carolinas?,Was ist der  Gebirgszug North Carolinas?,0.97672546
1080,37720,Was ist der wichtigste Wirtschaftszweig der Bergregion von North Carolina?,Was  der wichtigste Wirtschaftszweig der Bergregion von North Carolina?,0.9886852
1081,38131,Was sind Beispiele für Nutztiere?, sind Beispiele für Nutztiere?,0.9771099
1082,38132,Wie nennt man den Verzehr von Insekten?,Wie nennt man  Verzehr von Insekten?,0.9896226
1083,38133,In welchen Ländern werden Insekten verzehrt?,In welchen  werden Insekten verzehrt?,0.97644746
1084,38134,Welche Insekten können als Haustiere gehalten werden?,Welche Insekten können als Haustiere  werden?,0.9839008
1085,38135,Mit welchen Insekten sind Ameisen verwandt?,Mit welchen  sind Ameisen verwandt?,0.95780796
1086,38136,Welche Insekten können als Haustiere gehalten werden?, Insekten können als Haustiere gehalten werden?,0.98083633
1087,38137,Welche Insekten werden in der Pharmazie benutzt?, Insekten werden in der Pharmazie benutzt?,0.9781041
1088,38138,Welche Insekten werden als Versuchstiere eingesetzt?,Welche Insekten  als Versuchstiere eingesetzt?,0.98146075
1089,38139,Welche Insekten spielen eine große Rolle in der Kriminalistik?, Insekten spielen eine große Rolle in der Kriminalistik?,0.9829287
1090,38140,In welcher Produktion können Schildläuse eingesetzt werden?,In welcher Produktion  Schildläuse eingesetzt werden?,0.98340803
1091,38219,Welche Empfindlichkeit haben fotographische Aufnahmematerialen heutzutage? ,Welche Empfindlichkeit  fotographische Aufnahmematerialen heutzutage? ,0.9890041
1092,38221,Was ermöglicht ein empfindlicherer Film?,Was ermöglicht  empfindlicherer Film?,0.9727685
1093,38223,Was ist besser bei nierdigempfindlichen Filmen?,Was ist besser  nierdigempfindlichen Filmen?,0.9874563
1094,38241,Welche Zeitung in Großbritannien ist ähnlich zu BILD in Deutschland?,Welche  in Großbritannien ist ähnlich zu BILD in Deutschland?,0.9819027
1095,38243,"Welche Art von Zeitung ist ""The Sun""?","Welche  von Zeitung ist ""The Sun""?",0.9741621
1096,38244,Was zeichnet eine Boulevardzeitung aus?,Was zeichnet eine Boulevardzeitung ?,0.96733665
1097,38245,"Wer gibt die Zeitung ""The Sun"" heraus?","Wer gibt die  ""The Sun"" heraus?",0.9830313
1098,38246,"Seit wann gibt es eine Sonntagsausgabe von der Zeitung ""The Sun""?","Seit wann gibt es eine Sonntagsausgabe von der Zeitung ""The ""?",0.9966542
1099,38314,Als was arbeitete Edmund Burke von 1765 bis 1766?,Als was  Edmund Burke von 1765 bis 1766?,0.9647158
1100,38315,In welcher Organisation war Burke ein Mitglied in London?,In welcher  war Burke ein Mitglied in London?,0.98378927
1101,38316,Welche politische Werke stammen von Edmund Burke?,Welche  Werke stammen von Edmund Burke?,0.9948544
1102,38317,Was ist das Hauptwerk von Edmund Burke?, ist das Hauptwerk von Edmund Burke?,0.97400796
1103,38318,Was beinhaltet das Hauptwerk von Edmund Burke?,Was beinhaltet das Hauptwerk  Edmund Burke?,0.9934717
1104,41148,Wovon ist die galicische Musik geprägt?,Wovon ist die  Musik geprägt?,0.93588436
1105,41149,Welche international bekannte Musikgruppen spielen traditionelle galicische Musik?,Welche international bekannte  spielen traditionelle galicische Musik?,0.9874475
1106,41156,Nach wem ist der Bezirk Bronx in New York benannt?,Nach wem ist der Bezirk Bronx in New  benannt?,0.9947256
1107,41157,In welchem Jahr ist Bronx ein eigenständiger Stadtbezirk geworden?,In welchem Jahr  Bronx ein eigenständiger Stadtbezirk geworden?,0.9829075
1108,41158,Welche Straftaten gehörten ab den 1960er in Bronx zum Alltag?,Welche Straftaten gehörten ab  1960er in Bronx zum Alltag?,0.9962387
1109,41159,Wann hat überwiegend die Mittelschicht in Bronx gewohnt?,Wann hat überwiegend  Mittelschicht in Bronx gewohnt?,0.9952464
1110,38094,Was ist das größte menschliche Gen?,Was ist das größte menschliche ?,0.97862804
1111,38095,Wie viele Aminosäure hat das größte menschliche Gen?,Wie viele Aminosäure hat  größte menschliche Gen?,0.98310214
1112,38156,Wodurch ist die Region der Mexiko-Stadt gefährdet?,Wodurch ist die Region der Mexiko-Stadt ?,0.95906734
1113,38157,Wie viele Menschen wurden von einem Erdbeben  1985 in Mexiko-Stadt getötet?  ,Wie viele Menschen wurden  einem Erdbeben  1985 in Mexiko-Stadt getötet?  ,0.9977026
1114,38159,Wie viele Gebäude waren von dem Erdbeben 1985 in Mexiko-Stadt geschadet?,Wie viele Gebäude waren von dem Erdbeben 1985 in Mexiko-Stadt ?,0.9920081
1115,38160,Warum kam es zu so vielen Toten nach dem Erdbeben 1985 in Mexiko-Stadt?, kam es zu so vielen Toten nach dem Erdbeben 1985 in Mexiko-Stadt?,0.98929954
1116,38163,Wie sieht die Landschaft der Mexiko-Stadt aus?,Wie sieht die Landschaft der Mexiko-Stadt ?,0.9871857
1117,38165,Was wird in der Mexiko-Stadt angebaut?,Was wird in  Mexiko-Stadt angebaut?,0.9911598
1118,38166,Welche Metalle sind in der Region der Mexiko-Stadt zu finden?,Welche Metalle sind in der Region der Mexiko-Stadt zu ?,0.9902562
1119,38180,"Wann erschien der Soundtrack zum Film ""James Bond 007: Spectre""?","Wann erschien  Soundtrack zum Film ""James Bond 007: Spectre""?",0.9979073
1120,38181,"Wer singt im Soundtrack von ""James Bond 007: Spectre""?","Wer  im Soundtrack von ""James Bond 007: Spectre""?",0.9938245
1121,38182,Welchen Preis gewann Sam Smith für seinen Soundtrack bei der Oscarverleihung 2016?,Welchen Preis gewann Sam Smith für seinen  bei der Oscarverleihung 2016?,0.99244153
1122,38258,Auf welchem Kontinent liegen die US-Bundesstaaten?,Auf welchem Kontinent liegen  US-Bundesstaaten?,0.9938132
1123,38259,"Welche US-Bundesstaaten bilden das ""Kernland"" der USA?","Welche US-Bundesstaaten  das ""Kernland"" der USA?",0.9909955
1124,38261,Wie sieht die Landschaft der USA aus?,Wie sieht die Landschaft der  aus?,0.9714189
1125,38262,Wie heißt der Vulkan auf Hawaii?,Wie heißt der  auf Hawaii?,0.97917145
1126,38762,Warum distanzierte sich die evangelische Kirche von der römisch-katholischen?,Warum distanzierte sich die  Kirche von der römisch-katholischen?,0.9922977
1127,38764,Wie hat man die amerikanischen Anglikaner nach der Unabhängigkeitserklärung genannt?,Wie hat man die amerikanischen Anglikaner nach  Unabhängigkeitserklärung genannt?,0.9963881
1128,38767,Wann sind Waldenser entstanden?,Wann sind  entstanden?,0.9141676
1129,38770,Welche Gruppen der evangelischen Konfessionsfamilie sind in der Reformationszeit in deutschsprachigen Ländern entstanden?,Welche Gruppen der  Konfessionsfamilie sind in der Reformationszeit in deutschsprachigen Ländern entstanden?,0.9984186
1130,38772,Was sind die bekanntesten Reformatoren der Evangelisch-lutherischen Kirche?,Was sind die bekanntesten Reformatoren der -lutherischen Kirche?,0.99242896
1131,38773,Was sind die bekanntesten Reformatoren der Reformierten Kirche?,Was sind die bekanntesten Reformatoren der Reformierten ?,0.9859248
1132,38775,Was sind die bekanntesten Reformatoren der Anglikanischen Kirche?,Was  die bekanntesten Reformatoren der Anglikanischen Kirche?,0.9906727
1133,38777,Wie waren die deutschen evangelischen Landeskirchen organisiert?,Wie  die deutschen evangelischen Landeskirchen organisiert?,0.97966045
1134,38779,In welchen Ländern wächst die Anzahl der evangelischen Kirchen besonders stark?,In welchen Ländern wächst die Anzahl der  Kirchen besonders stark?,0.9960244
1135,38780,In welchen Ländern ist die Mehrheit der Bevölkerung evangelisch?,In welchen Ländern ist die Mehrheit  Bevölkerung evangelisch?,0.99223614
1136,41142,"Wer wird nach der Wiedervereinigung als ""Deutschen"" bezeichnet?","Wer wird nach der  als ""Deutschen"" bezeichnet?",0.9762685
1137,41143,"Warum kann es schwierig sein eine klare Definition von ""Deutschen"" zu geben?","Warum kann es schwierig sein  klare Definition von ""Deutschen"" zu geben?",0.9978763
1138,38089,Was passiert während der Regenzeit in Liberia?, passiert während der Regenzeit in Liberia?,0.97411555
1139,38090,Was ist die Hauptstadt von Liberia?,Was ist die Hauptstadt von ?,0.9463993
1140,38092,Wie unterschiedet sich die Menge von Niederschlägen in verschiedenen Regionen von Liberia?,Wie unterschiedet sich die Menge von  in verschiedenen Regionen von Liberia?,0.99462986
1141,38093,In welchem Bereich von Liberia ist Trockenzeit zu beobachten?,In welchem Bereich  Liberia ist Trockenzeit zu beobachten?,0.99439025
1142,38247,Wann wurde der USB 1.0 eingeführt?, wurde der USB 1.0 eingeführt?,0.9736716
1143,38248,Welche Unternehmen haben den USB 1.0 entwickelt?,Welche Unternehmen haben den  1.0 entwickelt?,0.9894105
1144,38249,Wer hat viel zur Entwicklung vom USB 1.0 beigetragen?, hat viel zur Entwicklung vom USB 1.0 beigetragen?,0.965066
1145,38250,Welche Fortschritte wurden mit der Herstellung vom ersten USB gemacht?,Welche Fortschritte wurden mit der Herstellung vom ersten  gemacht?,0.9924589
1146,40397,Wie viele Sprachen spricht man in Mali?,Wie viele Sprachen spricht man in ?,0.9762472
1147,40398,Was ist die bedeutendste Sprache in Mali?,Was ist die  Sprache in Mali?,0.98279804
1148,40399,Wie viele Menschen sprechen in Mali Bambara als Muttersprache? ,Wie viele Menschen sprechen in  Bambara als Muttersprache? ,0.99665076
1149,40401,Was ist die Amtssprache Malis?,Was ist die Amtssprache ?,0.9455738
1150,40402,Welche Sprachen werden in Mali als nationale Sprachen anerkannt?,Welche Sprachen werden in Mali als  Sprachen anerkannt?,0.9921573
1151,40403,Auf welcher Sprache studiert man in Mali?,Auf  Sprache studiert man in Mali?,0.9823546
1152,40404,Warum bleibt Französisch eine bedeutende Sprache in Mali?,Warum bleibt Französisch eine bedeutende  in Mali?,0.98369986
1153,38263,Wann wurden Juden in Bern zum ersten Mal erwähnt?,Wann wurden Juden in  zum ersten Mal erwähnt?,0.9923125
1154,38264,Was war die Folge des Ritualmordes an einem Kind in Bern 1294?,Was war die Folge des Ritualmordes an einem Kind in Bern ?,0.995506
1155,38265,Seit wann gibt es in Bern wieder eine jüdische Gemeinde?,Seit wann gibt es in Bern  eine jüdische Gemeinde?,0.9946588
1156,38266,Wann wurde die erste Synagoge in Bern gebaut?,Wann wurde die erste Synagoge in  gebaut?,0.9881923
1157,38290,"Wann ist das Fußballteam ""Irish"" aus der University of Notre Dame bekannt geworden?","Wann ist das Fußballteam ""Irish"" aus der University of Notre Dame bekannt ?",0.99447757
1158,38291,"Wann gewann das Fußballteam ""Irish"" die nationale Meisterschaft?","Wann gewann  Fußballteam ""Irish"" die nationale Meisterschaft?",0.99569374
1159,38292,"Wie heißt der Film über das Fußballteam ""Irish""?","Wie  der Film über das Fußballteam ""Irish""?",0.96021396
1160,38297,Wie lang ist die Straßenbahnstrecke in Mexiko-Stadt heutzutage?, lang ist die Straßenbahnstrecke in Mexiko-Stadt heutzutage?,0.986141
1161,38298,Warum ist der Verkehr in der Mexiko-Stadt oft blockiert?,Warum ist  Verkehr in  Mexiko-Stadt oft blockiert?,0.9902533
1162,38300,"Was wurde in Mexiko-Stadt unternommen, um den Straßenverkehr zu entlasten?","Was wurde in Mexiko-Stadt unternommen, um den Straßenverkehr zu ?",0.9897134
1163,38302,Wie viele Linien hat die Metro in Mexiko-Stadt?, viele Linien hat die Metro in Mexiko-Stadt?,0.9820334
1164,38303,Warum ist die Metro in Mexiko-Stadt heutzutage völlig überfordert?,Warum ist die Metro in Mexiko- heutzutage völlig überfordert?,0.98789155
1165,38304,Wann wurde die Eisenbahn in Mexiko privatisiert?,Wann wurde die Eisenbahn in Mexiko ?,0.96582353
