,id,questions,questions_perturbed,similarity_scores
1566,37301,Wieso hat Mohammed Mursi das Amt als Präsident Ägyptens niedergelegt?,Wieso hat Mohammed Mursi das Amt als Präsident Ägyptens ?,0.98767364
1567,37302,Wer ist Ägyptens Präsident?,Wer ist Ägyptens ?,0.9557879
1568,37330,Was für einen Glühfaden nutzen die ersten patentieren Glühlampen?,Was für einen Glühfaden nutzen  ersten patentieren Glühlampen?,0.99337286
1569,37331,Gibt es immer noch Kohlenfadenlampen?,Gibt es immer  Kohlenfadenlampen?,0.9938512
1570,37332,Welche Farbe hat das Licht von Kohlenfadenlampen?,Welche  hat das Licht von Kohlenfadenlampen?,0.98065805
1571,37333,Wie wurde aus Osmium ein Glühfaden hergestellt?,Wie wurde aus  ein Glühfaden hergestellt?,0.9804014
1572,37334,Welche Glühfäden ersetzen die Kohleglühfäden?, Glühfäden ersetzen die Kohleglühfäden?,0.98061
1573,37313,Seit wann wird Florida von Menschen bewohnt?,Seit wann wird  von Menschen bewohnt?,0.98155814
1574,37314,Welcher Europäer entdeckte Florida?,Welcher Europäer entdeckte ?,0.96836555
1575,37315,Wann wurde Florida entdeckt?,Wann wurde  entdeckt?,0.96689844
1576,37316,"Wer sollte die Kolonie ""La Florida"" gründen?","Wer sollte  Kolonie ""La Florida"" gründen?",0.99200094
1577,37317,Weshalb musste Pánfilo de Narváez mit der Erkundung Floridas aufhören?, musste Pánfilo de Narváez mit der Erkundung Floridas aufhören?,0.9883072
1578,37318,Bei was starb De Soto?,Bei was  De Soto?,0.9623456
1579,37353,Wie weit entwickelt sind Platzhocker Vögel beim schlüpfen?,Wie weit entwickelt sind Platzhocker Vögel beim ?,0.9882917
1580,37355,Wo sind Platzhocker Vögel bis sie fliegen können?,Wo  Platzhocker Vögel bis sie fliegen können?,0.9831853
1581,37356,Wer füttert Nesthocker Vögel so lange sie sich nicht selbstständig ernähren können?,Wer füttert Nesthocker Vögel so  sie sich nicht selbstständig ernähren können?,0.9936206
1582,37389,Wo ist der Genetiker Harry Ostrer angestellt?,Wo ist der Genetiker  Ostrer angestellt?,0.9956104
1583,37391,Welcher Gruppe ist die DNA von Juden ähnlich?,Welcher Gruppe ist die DNA von Juden ?,0.98496443
1584,37209,Wie viel wollte die EZB monatlich ab März 2015 für den Ankauf von Wertpapieren ausgeben?, viel wollte die EZB monatlich ab März 2015 für den Ankauf von Wertpapieren ausgeben?,0.99371755
1585,37211,Wie viel wollte die EZB insgesamt für das EAPP ausgeben?, viel wollte die EZB insgesamt für das EAPP ausgeben?,0.99355966
1586,37212,Wie wurden die Notwendigkeit der Ausgaben für die EAPP der EZB begründet?,Wie wurden die Notwendigkeit der  für die EAPP der EZB begründet?,0.9901936
1587,37241,Was wollte die EZB mit dem EAPP erreichen?,Was wollte die EZB  dem EAPP erreichen?,0.9825726
1588,37242,"Wie viel investierten die USA in das ähnliche Prinzip, dass die EAPP abschaute, zwischen 2009 und 2014?","Wie viel  die USA in das ähnliche Prinzip, dass die EAPP abschaute, zwischen 2009 und 2014?",0.9919941
1589,37243,Er war 2015 Italienischer Finanzminister?,Er  2015 Italienischer Finanzminister?,0.9850186
1590,37244,Welche Einstellung hatte der Bundesbank-Präsident gegenüber dem EAPP Programm?,Welche Einstellung hatte der Bundesbank-Präsident gegenüber dem EAPP ?,0.99520755
1591,37245,Was ist das BVerfG?,Was ist das ?,0.8840164
1592,37277,Wie heißen Valencias Universitäten?,Wie heißen Valencias ?,0.9638853
1593,37278,Wie viele Studenten hat Valencia?,Wie viele Studenten hat ?,0.9288327
1594,37279,Wie viel Geld musste Spanien aufgrund der Sparpolitik 2012 einsparen?,Wie viel Geld musste Spanien aufgrund der Sparpolitik  einsparen?,0.9964954
1595,37322,Wo in Hannover findet man Bauten von Georg Ludwig Friedrich Laves?,Wo in  findet man Bauten von Georg Ludwig Friedrich Laves?,0.98880965
1596,37323,In welchem Gebäude ist der Sitz des Niedersächsischen Landtages?,In welchem Gebäude ist der Sitz des Niedersächsischen ?,0.9812701
1597,37335,Was wird für die Bestimmung des Osterdatums verwendet?,Was wird für  Bestimmung des Osterdatums verwendet?,0.99251634
1598,37336,Wie groß ist der Fehler bei der Bestimmung des Osterdatums?,Wie groß ist der Fehler  der Bestimmung des Osterdatums?,0.9941211
1599,37361,Auf was beruhen Browserdatenstatistiken?,Auf was beruhen ?,0.90487653
1600,37362,Was übermittelt ein Browser bei jeder Anfrage an den Server womit er sich identifizieren lässt?,Was übermittelt ein Browser bei jeder Anfrage an den  womit er sich identifizieren lässt?,0.9931699
1601,37364,Was ist der meist benutzte Browser laut der Statistik von Netmarketshare von 2019?,Was ist  meist benutzte Browser laut  Statistik von Netmarketshare von 2019?,0.9941659
1602,37252,Wie wird das Gewicht von Papier meistens angegeben?, wird das Gewicht von Papier meistens angegeben?,0.97628194
1603,37253,Wie viel wiegt ein A4 Blatt?,Wie viel wiegt  A4 Blatt?,0.9949137
1604,37254,Wie wird Papier von Pappe unterschieden?, wird Papier von Pappe unterschieden?,0.9745453
1605,37255,Was versteht man in den USA unter dem Basisgewicht von Papier?,Was versteht man in den USA  dem Basisgewicht von Papier?,0.9895183
1606,37268,Zu welchem Sprachtyp gehört Russisch?,Zu  Sprachtyp gehört Russisch?,0.9611831
1607,37269,Wie viele Zeit Typen hat die deutsche Sprache?,Wie viele  Typen hat die deutsche Sprache?,0.99299103
1608,37280,Wie viele Autos werden von Ford südlich von Valencia gebaut?, viele Autos werden von Ford südlich von Valencia gebaut?,0.9852557
1609,37281,Wie viele Arbeitsplätze schafft das Ford Werk südlich von Valencia?,Wie viele Arbeitsplätze  das Ford Werk südlich von Valencia?,0.986414
1610,37326,Welches Regierungssystem hatte Polen ende des 18. Jahrhunderts?,Welches Regierungssystem hatte Polen ende  18. Jahrhunderts?,0.9975398
1611,37327,Was war der Hauptgegner der polnischen Aufklärung?,Was war der  der polnischen Aufklärung?,0.9561982
1612,37328,Wie lange war Stanslaw August Poniatowskis König von Polen?,Wie lange war Stanslaw August Poniatowskis König  Polen?,0.9969803
1613,37329,Wer veröffentlichte die erste polnische Enzyklopädie?,Wer veröffentlichte die erste  Enzyklopädie?,0.9788302
1614,37247,Was ist die Voraussetzung für die Weitergabe von gelernten Aktionen bei Säugetieren?,Was ist die Voraussetzung für die Weitergabe von  Aktionen bei Säugetieren?,0.9951843
1615,37310,Seit wann gibt es die Option eine Ausbildung in Teilzeit zu machen?,Seit wann  es die Option eine Ausbildung in Teilzeit zu machen?,0.98429924
1616,37311,Was wird gebraucht im eine Ausbildung in Teilzeit zu machen?,Was wird gebraucht im eine  in Teilzeit zu machen?,0.9909216
1617,37312,Wie viele Stunden wöchentlich muss man in der Ausbildung arbeiten um in der Regulären Zeit fertig werden zu dürfen?,Wie viele Stunden wöchentlich muss  in der Ausbildung arbeiten um in der Regulären Zeit fertig werden zu dürfen?,0.995363
1618,37208,Wie heißt der Entwicklungszeitraum des Menschen in dem er Geschlechtsreif wird?,Wie heißt der Entwicklungszeitraum  Menschen in dem er Geschlechtsreif wird?,0.9913675
1619,37256,Was ist das bekannteste Essen der valencianischen Küche?,Was ist das bekannteste Essen der  Küche?,0.9715969
1620,37257,"Was ist eine ""Paellera""?","Was ist eine """"?",0.936535
1621,37259,Woher kommt der Reis Bomba?,Woher kommt  Reis Bomba?,0.98930013
1622,37260,Was für ein Gericht ist die Fideuà?,Was für ein Gericht ist  Fideuà?,0.989541
1623,37261,Was ist ein typisch valencianisches Gericht aus Erdmandeln?, ist ein typisch valencianisches Gericht aus Erdmandeln?,0.985461
1624,37272,Aus welchem Land kommt Tigran Petrosjan?,Aus welchem Land kommt Tigran ?,0.9727093
1625,37274,Wie oft hat die Armenische Fußballmannschaft in der WM Endrunde mitgespielt?,Wie oft hat die Armenische  in der WM Endrunde mitgespielt?,0.9943605
1626,37275,Was ist Khoren Gevor größter Titel?, ist Khoren Gevor größter Titel?,0.9766391
1627,37276,Welche Staatsbürgerschaft verlor Arthur Abraham?,Welche Staatsbürgerschaft  Arthur Abraham?,0.96970916
1628,36860,Was erschwerte die Entwicklung der Zentralafrikanischen Republik bis zur Unabhängigkeit hauptsächlich?,Was  die Entwicklung der Zentralafrikanischen Republik bis zur Unabhängigkeit hauptsächlich?,0.94183326
1629,36861,Welche großen Probleme entstanden in der Zentralafrikanischen Republik seit der Unabhängigkeit?,Welche großen Probleme entstanden in  Zentralafrikanischen Republik seit  Unabhängigkeit?,0.9935732
1630,36862,Wie viel der Einwohner der Zentralafrikanischen Republik leben auf dem Land?,Wie viel der Einwohner der Zentralafrikanischen Republik leben auf dem ?,0.9919329
1631,36863,Was ist größte Wirtschaftszweig in der Zentralafrikanischen Republik?,Was ist größte  in der Zentralafrikanischen Republik?,0.9858557
1632,36864,Wie sieht die Handelsbilanz der Zentralafrikanischen Republik aus?,Wie sieht die Handelsbilanz  Zentralafrikanischen Republik aus?,0.99493647
1633,36865,Wie viele Touristen gab es in der Zentralafrikanischen Republik 2005?,Wie viele Touristen gab es in  Zentralafrikanischen Republik 2005?,0.9973219
1634,36866,Zu wem gehört Uramin?,Zu wem gehört ?,0.9013325
1635,37033,Was brauch man seit 2004 beim EU-Grenzübertritt für seinen Hund?,Was brauch man seit 2004 beim EU-Grenzübertritt für seinen ?,0.9940492
1636,37197,Seit wann wurde in Pennsylvania niemand mehr hingerichtet?,Seit wann wurde in Pennsylvania  mehr hingerichtet?,0.9807345
1637,37198,Wie viele Menschen sind in Pennsylvania in einer Todeszelle und warten auf die Hinrichtung?,Wie viele  sind in Pennsylvania in einer Todeszelle und warten auf die Hinrichtung?,0.99647886
1638,37199,Wer war 2007 Gouverneur von Pennsylvania?,Wer war  Gouverneur von Pennsylvania?,0.9875796
1639,37200,Wer wurde nach Ed Rendell Gouverneur Pennsylvanias?, wurde nach Ed Rendell Gouverneur Pennsylvanias?,0.98352796
1640,37201,Wer wurde nach Tom Corbett Gouverneur Pennsylvanias?,Wer wurde nach Tom  Gouverneur Pennsylvanias?,0.97772336
1641,37202,Welche Haltung zur Todesstrafe hatte Tom Corbett während seiner Amtszeit als Gouverneur?,Welche Haltung zur Todesstrafe hatte Tom Corbett während seiner Amtszeit  Gouverneur?,0.9931677
1642,37204,Welcher US-Bundestaat hat im Verhältnis zu den Einwohner am wenigsten Hinrichtungen?,Welcher US-Bundestaat  im Verhältnis zu den Einwohner am wenigsten Hinrichtungen?,0.98574203
1643,37248,Welche Universität war maßgebend beteiligt bei der ersten Unabhängigkeit Estlands?,Welche Universität war maßgebend beteiligt  der ersten Unabhängigkeit Estlands?,0.99561405
1644,37250,Wann wurde Estland das erste mal Unabhängig?,Wann wurde  das erste mal Unabhängig?,0.9759454
1645,37251,Wann trat Estland dem Völkerbund bei?,Wann trat Estland dem Völkerbund ?,0.9823995
1646,36848,Welche Kapazität hat eine Leidener Flasche,Welche Kapazität hat eine Leidener ,0.9649789
1647,36849,Aus was wird eine Leidener Flasche gebaut?,Aus was wird eine Leidener  gebaut?,0.98263127
1648,36850,Was ist der Isolator bei einer Leidener Flasche?,Was ist der Isolator bei einer  Flasche?,0.98995596
1649,36851,Wie wurde das Prinzip der Leidener Flasche entdeckt?,Wie wurde  Prinzip der Leidener Flasche entdeckt?,0.989638
1650,36852,Was schaffte Benjamin Franklin mit der Leidener Flasche und einem Drachen?,Was schaffte Benjamin Franklin mit der Leidener Flasche und  Drachen?,0.99555403
1651,36981,Wie viele Einwohner hat die Metropolregion Greater Boston?,Wie  Einwohner hat die Metropolregion Greater Boston?,0.990737
1652,36982,Zu welcher Metropolregion gehört Brookline?,Zu welcher Metropolregion  Brookline?,0.9710086
1653,37035,Wer ergänzte das Modell eines Kurzzeitgedächtnis?,Wer ergänzte das Modell  Kurzzeitgedächtnis?,0.9887989
1654,36781,Haben Tiere im Vergleich zu Menschen oft einen Herzinfakt?,Haben Tiere im Vergleich zu Menschen oft  Herzinfakt?,0.99319017
1655,36847,Welche Währungen sind Teil des Vergleich Korbes des USDX,Welche Währungen sind Teil des  Korbes des USDX,0.9945905
1656,36819,Mit wie vielen Währungen wird der US-Dollar beim USDX verglichen?,Mit wie  Währungen wird der US-Dollar beim USDX verglichen?,0.98572457
1657,37170,Wann war die Glorious Revolution in England?,Wann war die Glorious Revolution in ?,0.9939352
1658,37171,Wofür setzte sich John Milton während der Aufklärung ein?,Wofür setzte sich John Milton während der Aufklärung ?,0.99264055
1659,37172,War die Glorious Revolution gewaltsam?, die Glorious Revolution gewaltsam?,0.9658907
1660,37173,Woher kam König Wilhelm III.?,Woher kam König  III.?,0.987698
1661,37022,Wer wurde 1689 König Englands?,Wer wurde 1689 König ?,0.980843
1662,36643,In welcher Position spielte Howard Kendall beim FC Everton?,In  Position spielte Howard Kendall beim FC Everton?,0.9884383
1663,36644,In welcher Liga spielten die Blackburn Rovers als Howard Kendall Trainer wurde?,In welcher Liga spielten die Blackburn  als Howard Kendall Trainer wurde?,0.9976004
1664,36645,Wie ging das Fünftrunden Pokalspiel Rückspiel gegen Oxford United aus?,Wie ging das Fünftrunden  Rückspiel gegen Oxford United aus?,0.9931535
1665,36646,Wie lange war der FC Everton ungeschlagen nach dem Sieg gegen Oxford United im fünftrunden Pokalspiel?,Wie lange  der FC Everton ungeschlagen nach dem Sieg gegen Oxford United im fünftrunden Pokalspiel?,0.9933126
1666,36647,Wer gewann 1984 den FA Cup?,Wer  1984 den FA Cup?,0.94581556
1667,36648,Wer schoss die Tore im FA Cup Pokalfinale 1984?,Wer schoss die Tore im FA  Pokalfinale 1984?,0.99605846
1668,36649,Gegen wen spielte der FC Everton 1984 im FA Cup Pokalfinale?,Gegen wen spielte der FC Everton 1984 im FA  Pokalfinale?,0.9981363
1669,36650,Wer wurde in der Saison 1984/85 von der PFA zu Englands Fußballer des Jahres gewählt?,Wer wurde in der  1984/85 von der PFA zu Englands Fußballer des Jahres gewählt?,0.99696153
1670,36653,Von welchem Verein wechselte Pat Van Den Hauwe zum FC Everton,Von welchem  wechselte Pat Van Den Hauwe zum FC Everton,0.9760621
1671,36654,Wer gewann die englische Fußball Meisterschaft in der Saison 1984/85,Wer gewann  englische Fußball Meisterschaft in der Saison 1984/85,0.9956023
1672,36655,Wer gewann 1985 den FA Cup?, gewann 1985 den FA Cup?,0.97809047
1673,36658,Zu welchem Verein wechselte Gary Lineker 1986?,Zu welchem Verein  Gary Lineker 1986?,0.9692126
1674,36659,zum wievielten mal hintereinander stand der FC Everton 1986 im FA Cup Finale?,zum  mal hintereinander stand der FC Everton 1986 im FA Cup Finale?,0.98442256
1675,36661,Für welche Positionen wurde 1986 beim FC Everton hauptsächlich Spieler verplfichtet?,Für welche Positionen wurde 1986 beim FC Everton  Spieler verplfichtet?,0.9965424
1676,36663,Die wievielte Meisterschaft gewann der FC Everton 1987,Die wievielte Meisterschaft gewann der FC Everton ,0.99418736
1677,36664,Welchen Verein trainierte Howard Kendall nach dem FC Everton?, Verein trainierte Howard Kendall nach dem FC Everton?,0.97247833
1678,36984,wann gab es in der Antarktis die ersten Eisflächen?,wann gab es in der Antarktis die  Eisflächen?,0.9921565
1679,36986,welche Erdepoche war vor Miozän?,welche Erdepoche  vor Miozän?,0.9888377
1680,36987,Wann ging es zur Erdepoche Miozän über?,Wann ging es zur Erdepoche  über?,0.9838034
1681,36989,Wann trennte sich die Antarktis von Südamerika?,Wann  sich die Antarktis von Südamerika?,0.95949084
1682,36990,Was war vor dem Eis in der Antarktis?,Was war vor dem  in der Antarktis?,0.9827935
1683,36992,Weshalb gibt es kaum Pflanzen in der Antarktis?,Weshalb gibt es kaum  in der Antarktis?,0.98598075
1684,36996,Was ist das Gegenteil von Glaziale?,Was  das Gegenteil von Glaziale?,0.9814778
1685,37016,Wann wurde Fantastic Four #176 veröffentlicht?,Wann  Fantastic Four #176 veröffentlicht?,0.9826226
1686,37017,Wo konnte man den Namen Marvel Comics in den Comics von Marvel Comics wieder finden?,Wo konnte man den Namen Marvel Comics in den Comics von Marvel Comics  finden?,0.9957382
1687,36859,Wo steht der Schiedsrichter beim Canadian Football vor dem Snap?,Wo steht der Schiedsrichter beim Canadian Football vor dem ?,0.9919575
1688,37176,Wer zählt mit dem Schiedsrichter vor dem Snap das Down beim Kanadischen Football?,Wer zählt mit dem Schiedsrichter vor dem Snap das Down beim  Football?,0.99560857
1689,37179,Wer überwacht vor dem Snap die Bewegungen der Offensive-Line-Spieler auf seiner Seite beim Kanadischen Football?,Wer überwacht vor dem Snap  Bewegungen der Offensive-Line-Spieler auf seiner Seite beim Kanadischen Football?,0.9974588
1690,37180,Welcher Teil des Schiedsrichter Teams überwacht beim Kanadischen Football die Auswechslungen?,Welcher Teil des Schiedsrichter Teams überwacht beim Kanadischen Football die ?,0.9880235
1691,37182,Wer ist beim Kanadischen Football für die Kontrolle der 20-Sekunden-Uhr zuständig?,Wer ist beim Kanadischen Football für  Kontrolle der 20-Sekunden-Uhr zuständig?,0.9981528
1692,36974,Wo steht in dem Österreichischem Gesetz wie man Haushunde halten darf?,Wo  in dem Österreichischem Gesetz wie man Haushunde halten darf?,0.9864531
1693,36975,Wie oft muss ein Haushund in Österreich täglich mindestens ausgeführt werden?,Wie oft muss ein Haushund in Österreich  mindestens ausgeführt werden?,0.9975448
1694,36977,Ab wann darf man in Österreich Welpen von der Mutter entfernen?,Ab wann darf man in Österreich Welpen  der Mutter entfernen?,0.99562144
1695,36978,Wie hoch ist die Strafe wenn man den Kot seines Hundes in Wien nicht entfernt?,Wie hoch ist die Strafe wenn man den Kot seines  in Wien nicht entfernt?,0.9893166
1696,37003,Was machten die USA gegen die Piraten der  Barbareskenstaaten?,Was machten die  gegen die Piraten der  Barbareskenstaaten?,0.9948036
1697,37006,Warum brauchten die Amerikaner eine eigene See Armee?,Warum brauchten die Amerikaner eine eigene See ?,0.9968767
1698,37007,Wer war 1785 der US-Botschafter in Frankreich?,Wer war 1785 der US- in Frankreich?,0.98123384
1699,37008,Auf welche Art wollten die Amerikaner die Piraterie der Barbareskenstaaten anfangs verhindern?,Auf welche Art wollten  Amerikaner  Piraterie der Barbareskenstaaten anfangs verhindern?,0.9938818
1700,37009,Wie viel kosteten die Tribut- und Lösegeldzahlungen die USA 1800?,Wie viel kosteten  Tribut- und Lösegeldzahlungen  USA 1800?,0.9945456
1701,37010,Wer wurde 1801 Präsident der USA?,Wer  1801 Präsident der USA?,0.9872209
1702,37012,Wann war die Schlacht von Derna?,Wann  die Schlacht von Derna?,0.98168576
1703,37013,Wann endete der Amerikanisch-Tripolitanische-Krieg?,Wann endete  Amerikanisch-Tripolitanische-Krieg?,0.99560446
1704,36688,Ab wann herrschte in Myanmar ein Militärdiktatur?,Ab wann herrschte in Myanmar  Militärdiktatur?,0.99568415
1705,36689,Wie nannte sich die Militärdiktatur in Myanmar?,Wie  sich die Militärdiktatur in Myanmar?,0.9661908
1706,36692,Aus wie vielen Ministern bestand das Kabinett während der Militärdiktatur in Myanmar?,Aus wie vielen Ministern bestand  Kabinett während der Militärdiktatur in Myanmar?,0.9979228
1707,36733,Wie viele Provinzen hat Galicien?,Wie viele Provinzen hat ?,0.8995837
1708,36734,Wie viel Prozent der Fläche Spaniens hat Galicien?,Wie viel Prozent der Fläche Spaniens hat ?,0.96961164
1709,36735,Wie viel Prozent der Ortschaften Spaniens liegen in Galicien?,Wie viel Prozent der Ortschaften Spaniens liegen in ?,0.9794294
1710,36758,Wie viele Flugstunden überlebte die Hündin Laika in der Erdumlaufbahn?,Wie viele Flugstunden überlebte  Hündin Laika in der Erdumlaufbahn?,0.9979232
1711,36759,Woran starb die Hündin Laika?,Woran starb die  Laika?,0.97307837
1712,37018,"Was war das ""Hilton Assignment""?","Was war das ""Hilton ""?",0.9799977
1713,37019,"Wann wurde das ""Hilton Assignment"" ausgeführt?","Wann wurde das ""Hilton "" ausgeführt?",0.9832032
1714,37021,Wer opferte 1988 sein Leben um Gaddafi vor einem Anschlag zu retten?,Wer opferte 1988 sein Leben um Gaddafi  einem Anschlag zu retten?,0.9978594
1715,36709,Was hat Die Sowjetunion 1943 mit der Tschechoslowakei geschlossen?,Was hat  Sowjetunion 1943 mit der Tschechoslowakei geschlossen?,0.99609137
1716,36710,Wie lange waren das Abkommen der Sowjetunion und der DDR vom 12. März 1957 gültig?,Wie lange waren das Abkommen der Sowjetunion und der DDR vom 12. März  gültig?,0.9980252
1717,36711,Wer wollte 1963 dem Warschauer Pakt beitreten?,Wer  1963 dem Warschauer Pakt beitreten?,0.9918879
1718,36712,Warum wäre für den beitritt der Mongolischen Volksrepublik zum Warschauer Pakt ein Sonderprotokoll nötig gewesen?,Warum wäre für den beitritt der Mongolischen Volksrepublik zum Warschauer Pakt ein  nötig gewesen?,0.99005055
1719,36713,Warum ist die Mongolische Volksrepublik nicht dem Warschauer Pakt beigetreten?,Warum ist die Mongolische Volksrepublik nicht dem Warschauer Pakt ?,0.98986137
1720,36714,Was hat die Mongolische Volksrepublik anstatt eines Beitritts in den Warschauer Pakt bekommen?,Was hat  Mongolische Volksrepublik anstatt eines Beitritts in den Warschauer Pakt bekommen?,0.99763894
1721,36716,Wofür steht KSZE?,Wofür  KSZE?,0.9271022
1722,36729,"Womit kann man bei der ""Xbox Live Arcade"" spiele kaufen?"," kann man bei der ""Xbox Live Arcade"" spiele kaufen?",0.972492
1723,36730,"Wie lange kann ein aus dem ""Xbox Live Arcade"" gekauftes Spiel gespielt werden?","Wie lange kann ein aus dem ""Xbox Live Arcade"" gekauftes  gespielt werden?",0.99671596
1724,36731,Welches Spiel ist bei manchen Xbox Versionen bereits vorinstalliert?,Welches Spiel ist bei manchen Xbox Versionen  vorinstalliert?,0.9964225
1725,36732,"Welches Spiel ist im ""Xbox Live Arcade"" bis jetzt Bestseller?","Welches Spiel ist im ""Xbox  Arcade"" bis jetzt Bestseller?",0.9976951
1726,36752,"Welche Sportart wird in der Minor League gespielt?
","Welche Sportart wird in der  League gespielt?
",0.98787516
1727,36753,Wie viele Skigebiete hat Montana?, viele Skigebiete hat Montana?,0.97358155
1728,36724,Warum tragen Menschen Kleidung?, tragen Menschen Kleidung?,0.9415462
1729,36725,Welches Kleidungsstück schütz bei der Handhabung einer Motorsäge?,Welches Kleidungsstück schütz bei  Handhabung einer Motorsäge?,0.99772793
1730,36726,Was ist das Problem mit zu eng anliegender Kleidung?,Was  das Problem mit zu eng anliegender Kleidung?,0.99106425
1731,36736,Wer führte das Deutsche Militär während der Deutsch Französischen Kriege an?,Wer führte  Deutsche Militär während der Deutsch Französischen Kriege an?,0.9936125
1732,36737,Wie viele der deutschen Pferde starben während des Deutsch Französischen Krieges?,Wie viele der deutschen  starben während des Deutsch Französischen Krieges?,0.99509275
1733,36740,Wer wollte seinen Patriotismus Deutschland gegenüber durch die Teilnahme am Deutsch-Französischen-Krieg zeigen?,Wer wollte seinen Patriotismus Deutschland gegenüber durch die  am Deutsch-Französischen-Krieg zeigen?,0.99528587
1734,36741,Wie viele jüdische Soldaten hatte Deutschland im Deutsch-Französischen-Krieg?,Wie viele  Soldaten hatte Deutschland im Deutsch-Französischen-Krieg?,0.99353
1735,36743,Was war der eigentliche Plan der Franzosen im Deutsch-Französischen-Krieg?,Was war der eigentliche Plan der  im Deutsch-Französischen-Krieg?,0.9896977
1736,36744,"Ist Frankreich offensiv, oder defensiv an den Deutsch-Französischen-Krieg herangegangen?","Ist  offensiv, oder defensiv an den Deutsch-Französischen-Krieg herangegangen?",0.9893569
1737,36745,Wie viele Truppen hatten die Franzosen am Anfang des Deutsch-Französischen-Krieges?,Wie viele Truppen  die Franzosen am Anfang des Deutsch-Französischen-Krieges?,0.993345
1738,36746,Wo war der Vorteil der Französischen Ausrüstung im Deutsch-Französischen-Krieg?,Wo war der Vorteil der Französischen Ausrüstung im -Französischen-Krieg?,0.99566716
1739,36747,Ab wann führte der preußische Generalstab eine eigene Eisenbahnsektion?,Ab wann führte der preußische Generalstab  eigene Eisenbahnsektion?,0.9968182
1740,36748,Wie lange brauchten die Franzosen um für den Deutsch-Französischen-Krieg Kriegsbereit zu sein?, lange brauchten die Franzosen um für den Deutsch-Französischen-Krieg Kriegsbereit zu sein?,0.99228346
1741,36762,Wie viele Kilometer hat das Straßennetz Portugals 2008?,Wie viele Kilometer hat das Straßennetz  2008?,0.99658287
1742,36763,Wer unterhält die kostenpflichtigen Straßen Portugals größtenteils?, unterhält die kostenpflichtigen Straßen Portugals größtenteils?,0.9795478
1743,36749,Was ist Exergie?,Was  Exergie?,0.96898085
1744,36750,Wie kann der exergetische Anteil bei einer konstant liegenden Wärmequelle berechnet werden?,Wie kann der exergetische Anteil bei einer konstant  Wärmequelle berechnet werden?,0.9981879
1745,36751,Was wird für die Berechnung der Carnot-Wirkungsgrad Methode benötigt?,Was wird für die Berechnung  Carnot-Wirkungsgrad Methode benötigt?,0.99538404
1746,36760,"Wie viele Regionen hatte Eritrea vor der Verwaltungsreform von 1996?
","Wie viele Regionen  Eritrea vor der Verwaltungsreform von 1996?
",0.98844403
1747,36761,Welches Land kolonialisierte Eritrea?,Welches Land kolonialisierte ?,0.96678305
1748,36419,Was ist die Hauptsatd großbritanniens, ist die Hauptsatd großbritanniens,0.9772844
1749,36420,Wie sieht die geologische Beschaffenheit Südostenglands aus?,Wie sieht  geologische Beschaffenheit Südostenglands aus?,0.99447143
1750,36652,In welchem Teil von Großbritannien liegt London?,In welchem  von Großbritannien liegt London?,0.98809224
1751,36656,"Welche Völker haben versucht, England zu erobern?"," Völker haben versucht, England zu erobern?",0.97435224
1752,36693,Wann wurde die erste Person in Alabama hingerichtet?,Wann wurde  erste Person in Alabama hingerichtet?,0.99441665
1753,36694,Was war ab 1927 die beliebteste Hinrichtungsmethode in Alabama?, war ab 1927 die beliebteste Hinrichtungsmethode in Alabama?,0.98696876
