,id,questions,questions_perturbed,similarity_scores
395,41760,Wer greift Scout und ihren Bruder am Ende des Romans Wer die Nachtigall stört an?,Wer greift Scout und  Bruder am Ende des Romans Wer die Nachtigall stört an?,0.99600506
396,41764,Wer rettet Scout und ihren Bruder vor Ewells Angriff in Wer die Nachtigall stört?,Wer rettet Scout und ihren  vor Ewells Angriff in Wer die Nachtigall stört?,0.9964492
397,44038,Welche Staats- und Regierungsform befürwortete Locke?, Staats- und Regierungsform befürwortete Locke?,0.96418804
398,44039,Wann hat Montesquieu die Persischen Briefe veröffentlicht?,Wann hat  die Persischen Briefe veröffentlicht?,0.96085966
399,44040,Mit welcher Aufgabe war Montesquieu am Gericht von Bordeaux betraut?,Mit welcher Aufgabe  Montesquieu am Gericht von Bordeaux betraut?,0.9929038
400,44043,Worin besteht für Montesquieu politische Freiheit?,Worin besteht für Montesquieu politische ?,0.9901804
401,44044,Wie heißt das Buch von Montesquieu zur Staatstheorie?,Wie heißt das  von Montesquieu zur Staatstheorie?,0.9872493
402,36538,Welche Airlines fliegen von dem St. John’s International Airport aus? ,Welche  fliegen von dem St. John’s International Airport aus? ,0.9896826
403,36539,Welche Städte innerhalb Kanada kann man von dem St. John's International Airport erreichen?,Welche Städte innerhalb Kanada kann  von dem St. John's International Airport erreichen?,0.99499387
404,36540,Welche Städte außerhalb Kanada sind von dem St. John's International Airport erreichbar?,Welche Städte außerhalb Kanada sind von dem St. 's International Airport erreichbar?,0.99744666
405,36591,Was bedeutet Luxuspapiere?,Was  Luxuspapiere?,0.9317336
406,36592,Welche Methoden wurden zur Veredelung der Luxuspapiere eingesetzt?,Welche Methoden  zur Veredelung der Luxuspapiere eingesetzt?,0.9853108
407,36593,In welchen Ländern wird das Papier in Innenräumen als Einrichtung verwendet?,In welchen Ländern wird  Papier in Innenräumen als Einrichtung verwendet?,0.99657494
408,37055,Wie viel Prozent der Stimmen hat Miguel Angel Mancera bei den Wahlen bekommen?,Wie viel  der Stimmen hat Miguel Angel Mancera bei den Wahlen bekommen?,0.99140716
409,37056,Wie viel Prozent der Stimmen hat der Vorgänger von Miguel Angel Mancera bei den Wahlen bekommen?,Wie viel Prozent der Stimmen  der Vorgänger von Miguel Angel Mancera bei den Wahlen bekommen?,0.99199224
410,37057,Wer war der Vorgänger von Marcelo Ebrard?,Wer war der  von Marcelo Ebrard?,0.9697328
411,37060,Seit wann gibt es einen Regierungschef in Mexiko-Stadt?, wann gibt es einen Regierungschef in Mexiko-Stadt?,0.98418754
412,37064,"Wer hat die Mexiko-Stadt vorher regiert, bevor es einen Stadtoberhaupt gab? ","Wer hat  Mexiko-Stadt vorher regiert, bevor es einen Stadtoberhaupt gab? ",0.9978186
413,37066,Wer regiert in den einzelnen Bezirken in Mexiko-Stadt?,Wer regiert in den einzelnen Bezirken in Mexiko-?,0.99049556
414,37067,Was war das Ziel der Verwaltungsreform 1982 in Mexiko-Stadt?,Was war das Ziel der Verwaltungsreform  in Mexiko-Stadt?,0.99375606
415,37074,Wer war der erste frei gewählte Regierungschef der Mexiko-Stadt?,Wer war der  frei gewählte Regierungschef der Mexiko-Stadt?,0.98557097
416,37077,Wer war der Vorgänger des ersten frei gewählten Regierungschefs von Mexiko-Stadt?,Wer war der Vorgänger  ersten frei gewählten Regierungschefs von Mexiko-Stadt?,0.99246657
417,37078,Was ist die regierende Partei von Mexiko-Stadt?,Was ist  regierende Partei von Mexiko-Stadt?,0.99175656
418,37081,Wann hat Andrés Manuel López Obrador in den Präsidentschaftswahlen teilgenommen?,Wann  Andrés Manuel López Obrador in den Präsidentschaftswahlen teilgenommen?,0.9956404
419,37100,Welche Outdoorsportarten sind populär in North Carolina?,Welche Outdoorsportarten sind  in North Carolina?,0.98749816
420,37101,Wie wird der Breitensport in North Carolina gefördert?,Wie wird der Breitensport in North Carolina ?,0.9821798
421,37104,Welche Sportveranstaltungen finden in North Carolina jährlich statt?, Sportveranstaltungen finden in North Carolina jährlich statt?,0.97733265
422,37105,Wofür stellt der North Carolina Amateur Sports Mittel zur Verfügung?,Wofür stellt der North Carolina Amateur Sports  zur Verfügung?,0.98609793
423,37576,Warum hat der Fürst Menschikow den Militär nach Konstantinopel entsandt? ,Warum hat der  Menschikow den Militär nach Konstantinopel entsandt? ,0.9971699
424,37590,Was forderte Fürst Menschikow vom Sultan des Osmanischen Reiches 1853?,Was forderte Fürst  vom Sultan des Osmanischen Reiches 1853?,0.99405694
425,37591,"Wann reiste Menschikow aus dem Osmanischen Reich ab, nachdem seine Mission gescheitert ist?","Wann reiste Menschikow aus dem Osmanischen Reich ab,  seine Mission gescheitert ist?",0.9941022
426,37599,Wer hat versucht russische Häfen 1854 in der Ostsee zu blockieren?,Wer hat versucht russische Häfen  in der Ostsee zu blockieren?,0.99545985
427,37603,Wer war der wichtigste militärische Berater vom Fürst Menschikow?,Wer war der wichtigste  Berater vom Fürst Menschikow?,0.9960473
428,36811,"Warum war die Raumfahrt in den 60ern so populär?
","Warum war die Raumfahrt in den 60ern so ?
",0.9903869
429,40519,Welches Recht befasst sich mit der Jagd?,Welches Recht befasst sich mit der ?,0.96417844
430,40533,Auf was basiert das objektive Jagdrecht meistens?,Auf was basiert das objektive Jagdrecht ?,0.9943907
431,36598,Seit wann nimmt Guam an allen Olympischen Sommerspielen teil?,Seit wann nimmt  an allen Olympischen Sommerspielen teil?,0.98570293
432,36599,In welchen Vereinen ist die Guams Fußballnationalmannschaft ein Mitglied?,In  Vereinen ist die Guams Fußballnationalmannschaft ein Mitglied?,0.9783854
433,36601,Wann hat Guam in einem Spiel gegen Turkmenistan gewonnen?,Wann hat Guam in einem Spiel gegen  gewonnen?,0.97766954
434,36794,Was ist der Föderalismus im engeren Sinne?,Was ist  Föderalismus im engeren Sinne?,0.99165714
435,36795,"Was bedeutet ""nachhaltiger Föderalismus""?","Was bedeutet "" Föderalismus""?",0.98206556
436,37084,Wie unterscheiden sich Gehirne von Männern und Frauen?,Wie  sich Gehirne von Männern und Frauen?,0.9423263
437,37085,Wie viel wiegt das Gehirn eines Mannes durchschnittlich?,Wie viel wiegt das  eines Mannes durchschnittlich?,0.99195176
438,37086,Wie groß ist der Unterschied zwischen dem Gewicht des Gehirnes eines Mannes und einer Frau?,Wie groß ist der Unterschied  dem Gewicht des Gehirnes eines Mannes und einer Frau?,0.99479127
439,37087,Wie schwer ist das Gehirn eines Blauwalles?,Wie schwer ist das Gehirn  Blauwalles?,0.98111326
440,37088,Welchem Tier ähnelt sich der Hippocampus?,Welchem Tier ähnelt sich  Hippocampus?,0.9945485
441,37089,Wofür ist der Hippocampus zuständig?,Wofür ist der  zuständig?,0.9248473
442,37090,Was ist der Unterschied zwischen dem Hippocampus eines Mannes und einer Frau?,Was ist der Unterschied zwischen dem Hippocampus eines Mannes und  Frau?,0.99631447
443,37091,Wofür ist die Amygdala zuständig?,Wofür ist die Amygdala ?,0.9408732
444,37092,Was ist der Unterschied zwischen einer Amygdala eines Mannes und einer Frau?,Was ist der Unterschied zwischen  Amygdala eines Mannes und  Frau?,0.9930816
445,37093,Wie unterscheiden sich die beiden Hirnhemisphären im Bezug auf Sprache und Raumvorstellung bei Männern und Frauen?, unterscheiden sich die beiden Hirnhemisphären im Bezug auf Sprache und Raumvorstellung bei Männern und Frauen?,0.99343234
446,37095,Wie kann man den Unterschied in den beiden Hirnhemisphären von Männern und Frauen erklären?,Wie  man den Unterschied in den beiden Hirnhemisphären von Männern und Frauen erklären?,0.99360716
447,37096,Wie können die Geschlechtschromosomen die Entwicklung beeinflussen?,Wie können  Geschlechtschromosomen  Entwicklung beeinflussen?,0.9825819
448,37106,Wer ließ 1702 San Agustin zerstören?,Wer  1702 San Agustin zerstören?,0.9787841
449,37108,Wann nahmen Franzosen die spanische Siedlung in Pensacola im Westen Floridas ein?,Wann nahmen Franzosen die spanische Siedlung in Pensacola im Westen  ein?,0.9940881
450,36839,Wann wurde San Agustin angegriffen und ausgeräubert?,Wann wurde  Agustin angegriffen und ausgeräubert?,0.9965752
451,37109,Wo liegt Guinea-Bissau?,Wo  Guinea-Bissau?,0.96002054
452,37110,Welches Land grenzt an Guinea-Bissau im Norden?, Land grenzt an Guinea-Bissau im Norden?,0.9855951
453,37112,Welches Land grenzt an Guinea-Bissau im Osten?,Welches Land grenzt an Guinea- im Osten?,0.98003703
454,37114,Wie groß ist Guinea-Bissau?,Wie groß ist -Bissau?,0.9680151
455,37117,Was ist die Hauptstadt von Guinea- Bissau?,Was ist  Hauptstadt von Guinea- Bissau?,0.9955793
456,44026,Wie wird die Northwestern University auch gennant?,Wie wird die Northwestern University  gennant?,0.99357253
457,44027,In welchem Bundesstaat ist die Northwestern University angesiedelt?,In welchem Bundesstaat ist die Northwestern University ?,0.99160117
458,44028,In welcher Stadt ist die Northwestern University?,In welcher Stadt  die Northwestern University?,0.99060035
459,44029,Wie heißt das U-Bahnsystem in Chicago?,Wie heißt das U- in Chicago?,0.972868
460,44030,An welchem See liegt die Northwestern University?,An welchem See liegt die  University?,0.9638386
461,44031,In welcher Stadt ist der zentrale Campus der Northwestern University?,In welcher Stadt ist der zentrale Campus der Northwestern ?,0.9938401
462,44032,Wie groß ist der Hauptcampus der Northwestern University?,Wie  ist der Hauptcampus der Northwestern University?,0.97691286
463,44033,Seit wann gibt es die Kellogg School of Management an der NU?,Seit wann gibt es die Kellogg School of  an der NU?,0.99695516
464,44034,Wie viele Studierende gibt es an der Northwestern University?,Wie viele Studierende gibt es an  Northwestern University?,0.99701315
465,44035,Ist die Northwestern eine private oder staatliche Universität?,Ist die Northwestern  private oder staatliche Universität?,0.99400514
466,44036,Wie heißt die studentische Zeitung an der Northwestern University?,Wie heißt die studentische  an der Northwestern University?,0.97780275
467,44037,Wann wurde die Association of American Universities gegründet?, wurde die Association of American Universities gegründet?,0.987623
468,41145,Wie viele Soldaten in China starben im Pazifikkrieg?, viele Soldaten in China starben im Pazifikkrieg?,0.98135245
469,41146,Wie viele japanische Soldaten fielen im Pazifikkrieg?,Wie viele japanische Soldaten  im Pazifikkrieg?,0.98260516
470,41153,Was versteht man unter der Lesbarkeit in der Architektur?,Was versteht man  der Lesbarkeit in der Architektur?,0.98317426
471,41154,Welche Themen sind seit den zunehmenden Debatten um die globale Erwarmung in der Architektur wichtig geworden?,Welche Themen sind seit den  Debatten um die globale Erwarmung in der Architektur wichtig geworden?,0.99719316
472,41155,"Was versteht man unter dem Begriff ""Solararchitektur""?","Was versteht man  dem Begriff ""Solararchitektur""?",0.98239666
473,38837,"Was macht der Rettungsdienst als erstes, wenn ein Patient den Herzinfarkt hat?","Was  der Rettungsdienst als erstes, wenn ein Patient den Herzinfarkt hat?",0.9885902
474,38840,Warum wird die Therapie mit Sauerstoff beim Herzinfarkt nicht mehr durchgeführt?,Warum wird die Therapie mit  beim Herzinfarkt nicht mehr durchgeführt?,0.9913479
475,38841,Welche Medikamente können beim Herzinfarkt manchmal erforderlich sein?,Welche  können beim Herzinfarkt manchmal erforderlich sein?,0.9816417
476,41169,Wie wurde Gaddafi getötet?,Wie wurde  getötet?,0.9153914
477,41168,"Welche Organisation hat geholfen Gaddafi 2011 zu finden, als er geflohen ist?","Welche Organisation hat geholfen Gaddafi 2011 zu finden, als er  ist?",0.9949037
478,41170,Wo wurde die Leihe von Gaddafi bestattet?,Wo wurde die  von Gaddafi bestattet?,0.9920293
479,38791,Wann ist die Literatur in Tibet sehr religiös geprägt geworden?,Wann ist die Literatur in Tibet sehr  geprägt geworden?,0.9868423
480,38794,Wie hat sich die Literatur in Tibet mit der Annexion des Landes durch China verändert? ,Wie hat sich die Literatur in  mit der Annexion des Landes durch China verändert? ,0.99374235
481,38796,Was wird unter der tibetischen Literatur verstanden?,Was wird unter  tibetischen Literatur verstanden?,0.99591005
482,41171,Wer hat das Famicon entworfen?,Wer hat  Famicon entworfen?,0.9872502
483,41172,In welchem Land hat man das Famicon verkauft?,In welchem Land hat man  Famicon verkauft?,0.9956498
484,41173,Wie hieß die erste Nintendo-Konsole?,Wie  die erste Nintendo-Konsole?,0.93509763
485,41174,Welches Zubehör hatte die erste Nintendo?,Welches  hatte die erste Nintendo?,0.9706402
486,41175,In welchen Paketen konnte man das Nintendo Entertainment System 1985 kaufen?,In welchen Paketen konnte man das Nintendo  System 1985 kaufen?,0.99829984
487,44115,Wann reagiert das Immunsystem übermäßig auf bestimmte körperfremde Strukturen?,Wann reagiert das Immunsystem übermäßig auf  körperfremde Strukturen?,0.9987164
488,44113,Was ist der Grund von Autoimmunerkrankungen?,Was ist der Grund von ?,0.9179922
489,44114,Was sind die Beispiele für Autoimmunerkrankungen?,Was sind die Beispiele für ?,0.94142735
490,44118,Was ist ein Erfordernis für die Entstehung einer Allergie?,Was ist  Erfordernis für die Entstehung einer Allergie?,0.99042135
491,44120,Welche Allergien treten am häufigsten auf?,Welche Allergien treten am  auf?,0.97456956
492,40395,Bei welchen Softwaretests wird die Automatisierung empfohlen?,Bei welchen Softwaretests wird  Automatisierung empfohlen?,0.9878541
493,40427,Welcher Wert ist extrem wichtig bei der Papierherstellung?,Welcher Wert ist extrem wichtig bei  Papierherstellung?,0.99629
494,40428,Wovon hängt die Zugfestigkeit von Papier ab?,Wovon hängt die Zugfestigkeit  Papier ab?,0.99130374
495,40429,Wie wird die Zugfestigkeit von Papier gemessen?,Wie wird die Zugfestigkeit von Papier ?,0.9876832
496,40430,Was bestimmt der spezifische Weiterreißwiderstand von Papier?, bestimmt der spezifische Weiterreißwiderstand von Papier?,0.97905207
497,40431,Wie wird der spezifische Weiterreißwiderstand von Papier gemessen?,Wie wird der spezifische  von Papier gemessen?,0.96816254
498,40433,Was macht der Berstwiderstand beim Papier?,Was macht  Berstwiderstand beim Papier?,0.98969144
499,40434,Wie wird der Berstwiderstand beim Papier gemessen?,Wie wird der  beim Papier gemessen?,0.9655203
500,40435,Was ist unter dem Spaltwiderstand beim Papier gemeint?,Was ist unter  Spaltwiderstand beim Papier gemeint?,0.9940723
501,38836,Wie werden intensive Grüntöne bezeichnet?,Wie werden intensive Grüntöne ?,0.96235585
502,41188,Wie viel Prozent der Bevölkerung sprechen Deutsch als Muttersprache?,Wie viel Prozent der Bevölkerung  Deutsch als Muttersprache?,0.99027133
503,41189,Was ist die gesprochene Umgangssprache in Bern?,Was ist die  Umgangssprache in Bern?,0.98844343
504,41190,Was ist eine der Besonderheiten des Berndeutsches?,Was ist eine  Besonderheiten des Berndeutsches?,0.98597115
505,40405,Wodurch zeichnen sich Chloroplasten und Mitochondrien aus?,Wodurch zeichnen sich  und Mitochondrien aus?,0.9878269
506,40471,Wo liegt San Diego?,Wo liegt San ?,0.97744817
507,40472,Was grenzt an Westen von San Diego?,Was  an Westen von San Diego?,0.9482845
508,40473,Was grenzt an Osten von San Diego?,Was grenzt an Osten von  Diego?,0.9919434
509,40474,In wie viele Teile wird San Diego geteilt?,In wie viele Teile  San Diego geteilt?,0.98322964
510,40475,Was ist der höchste Punkt San Diegos?,Was ist der höchste Punkt San ?,0.97630423
511,40476,Welchen Fluss gibt es in San Diego?,Welchen  gibt es in San Diego?,0.9721376
512,41193,Was ist das Hauptwerk von Charles Darwin?,Was ist das Hauptwerk von  Darwin?,0.9955376
513,41194,"Wann wurde ""Über die Entstehung der Arten"" veröffentlicht?","Wann  ""Über die Entstehung der Arten"" veröffentlicht?",0.98521847
514,41195,Was hat Charles Darwin in seinem Hauptwerk bewiesen?,Was hat  Darwin in seinem Hauptwerk bewiesen?,0.9979709
515,41196,Wo hat Charles Darwin Belege für seine Theorie gesammelt?,Wo hat Charles Darwin Belege für  Theorie gesammelt?,0.99458
516,41351,Was war die ursprüngliche Religion der Slawen?, war die ursprüngliche Religion der Slawen?,0.975176
517,41352,Mit welchem Namen haben die Slawen den Gott genannt?,Mit welchem Namen  die Slawen den Gott genannt?,0.98814344
518,41353,Welche mythische Wesen wurden von den Slawen verehrt?,Welche mythische Wesen wurden  den Slawen verehrt?,0.9928592
519,41354,Was brachten die Slawen den Göttern zum Opfer?,Was brachten die  den Göttern zum Opfer?,0.98744327
520,41355,Was passiert mit der Seele nach dem Tod laut Slawen?,Was passiert mit  Seele nach dem Tod laut Slawen?,0.99164975
521,41360,Wer hat Tristan da Cunha in seinem Roman im Jahr 1838 ausführlich beschrieben?,Wer hat  da Cunha in seinem Roman im Jahr 1838 ausführlich beschrieben?,0.9937948
522,41361,"Wer hat einen Roman über Tristan da Cunha geschrieben, der denselben Namen wie diese Inselgruppe trägt?"," hat einen Roman über Tristan da Cunha geschrieben, der denselben Namen wie diese Inselgruppe trägt?",0.9945782
523,41362,In welchem Werk hat Jule Verne Tristan da Cunha dargestellt?,In  Werk hat Jule Verne Tristan da Cunha dargestellt?,0.98313665
524,42095,Wann hat der Österreichische Erbfolgekrieg stattgefunden?,Wann  der Österreichische Erbfolgekrieg stattgefunden?,0.98855495
525,42096,Was beendete den Österreichischen Erbfolgekrieg?,Was beendete den  Erbfolgekrieg?,0.9867966
526,42098,"Was hat Österreich versucht, um Schlesien zurückzugewinnen?","Was hat Österreich versucht, um  zurückzugewinnen?",0.96952593
527,42100,In welchem Jahr verschlechterte sich der britisch- französische Konflikt in Nordamerika?,In welchem  verschlechterte sich der britisch- französische Konflikt in Nordamerika?,0.9718535
528,42101,Wer wollte das Bündnis von Frankreich und Preußen  Mitte des 18.Jahrhundert vermeiden? ,Wer wollte das Bündnis von Frankreich und   Mitte des 18.Jahrhundert vermeiden? ,0.9905885
529,42102,Worum ging es im Vertrag von Sankt Petersburg zwischen Großbritannien und Russland?,Worum ging es im Vertrag von Sankt  zwischen Großbritannien und Russland?,0.9964027
530,42103,Wann hat Großbritannien die Westminister-Konvention mit Preußen geschlossen?,Wann hat Großbritannien  Westminister-Konvention mit Preußen geschlossen?,0.99498624
531,42104,Was hat die Westminister-Konvention von 1756 garantiert?,Was hat die Westminister-Konvention von  garantiert?,0.98713213
532,42105,An welchem Tag hat Großbritannien Frankreich 1756 den Krieg erklärt?,An welchem Tag hat Großbritannien Frankreich 1756 den  erklärt?,0.98217666
533,41206,Warum glühen erhitzte Körper zunächst rot?,Warum glühen erhitzte  zunächst rot?,0.9859644
534,41207,Welche Sinneszellen im menschlichen Auge sind für das Rotsehen verantwortlich?,Welche Sinneszellen im  Auge sind für das Rotsehen verantwortlich?,0.9961254
535,41394,Mit welcher Geschwindigkeit kann man Daten mithilfe eines USB-Sticks übertragen?,Mit welcher  kann man Daten mithilfe eines USB-Sticks übertragen?,0.9862989
536,41404,Welcher im 14.Jahrhundert angelegte künstliche See in Jaisalmer wurde von der Bevölkerung gepflegt? ,Welcher im 14.Jahrhundert angelegte künstliche See in Jaisalmer wurde von der  gepflegt? ,0.9957009
537,41405,Was war die Quelle des Trinkwassers in Jaisalmer?,Was war die Quelle des  in Jaisalmer?,0.964909
538,44008,Wie nennt man religiöse Stiftungen in Iran?, nennt man religiöse Stiftungen in Iran?,0.97659135
539,44009,Warum werden religiöse Stiftungen in Iran kritisiert?, werden religiöse Stiftungen in Iran kritisiert?,0.98438317
540,44010,In welchen Bereichen der Wirtschaft haben religiöse Stiftungen in Iran herrschende Stellung?,In welchen Bereichen der Wirtschaft haben religiöse  in Iran herrschende Stellung?,0.99574804
541,44011,Was sind die zwei größten religiösen Stiftungen in Iran?,Was sind die  größten religiösen Stiftungen in Iran?,0.9946984
542,41210,Wie ist der Achtfache Pfad im Buddhismus geteilt?,Wie ist  Achtfache Pfad im Buddhismus geteilt?,0.9903551
543,41209,Was ist das Kern der Lehre des Buddha?,Was ist das Kern der Lehre des ?,0.9747159
544,41396,Welche Wirkung können manche für die Munitionsproduktion eingesetzte Metalle haben?, Wirkung können manche für die Munitionsproduktion eingesetzte Metalle haben?,0.9932282
545,41397,Wie kann das Geschossmaterial der Natur schaden? ,Wie kann das Geschossmaterial  Natur schaden? ,0.9849309
546,41398,Warum wird die Verwendung von Blei in der Munition kritisiert?,Warum wird die  von Blei in der Munition kritisiert?,0.98097146
547,44097,Wo finden Vakuumkondensatoren ihre Anwendung?,Wo  Vakuumkondensatoren ihre Anwendung?,0.9835707
548,44098,Wann werden Vakuumkondensatoren eingesetzt?,Wann werden Vakuumkondensatoren ?,0.9810278
549,44100,Warum werden Glimmerkondensatoren für hohe Anforderungen eingesetzt?,Warum  Glimmerkondensatoren für hohe Anforderungen eingesetzt?,0.99144995
550,44102,Warum werden Schutzringkondensatoren gebaut?,Warum werden Schutzringkondensatoren ?,0.98411465
551,44104,Wie viele Schichten haben mehrlagige Leiterplatten?,Wie viele Schichten haben mehrlagige ?,0.98589987
552,40504,Was ist ein Kurzschluss?,Was ist  Kurzschluss?,0.9480122
553,40505,Wie entsteht ein Kurzschluss?,Wie entsteht ein ?,0.9338187
554,40508,Wie funktionieren Kurzschlusstests?,Wie funktionieren ?,0.8922992
555,36704,Als was bezeichnen die Demokraten bei Wahlen die im Ausland lebenden Wähler?,Als was bezeichnen die Demokraten bei Wahlen die im Ausland lebenden ?,0.99338233
556,37203,Was war das Grundprinzip von Alfred North Whiteheads Schaffen?,Was war das Grundprinzip von Alfred  Whiteheads Schaffen?,0.9974524
557,37206,Wie heißt das erste Werk von Whitehead im Bereich Naturphilosophie?,Wie heißt das erste Werk von Whitehead im  Naturphilosophie?,0.9942438
558,38579,Wo ist die Yale University?,Wo ist die Yale ?,0.9779749
559,38581,Welche ist die drittälteste Uni der USA?,Welche  die drittälteste Uni der USA?,0.988467
560,38583,Wessen Namen trägt die Yale University?,Wessen Namen trägt die Yale ?,0.9711827
561,38584,Welche Universität verfügt weltweit über das meiste Kapital?,Welche Universität verfügt weltweit über das meiste ?,0.98239875
562,38585,Was ist die Ivy League?,Was ist die  League?,0.95714295
563,38586,Seit wann gibt es die Association of American Universities?,Seit wann  es die Association of American Universities?,0.9691915
564,38587,Welches sind die drei wichtigsten Universitäten der USA?,Welches sind die  wichtigsten Universitäten der USA?,0.98583853
565,38588,Wie viele bücher hab es 2009 in den Bibliotheken von Yale?,Wie viele bücher hab es  in den Bibliotheken von Yale?,0.99285203
566,38589,Wie viele US-Präsidenten haben in Yale studiert?,Wie viele US-Präsidenten haben in  studiert?,0.98943603
567,40532,Was ist armenische Kunst?,Was ist armenische ?,0.97034216
568,37390,Wie sind Daten auf Laserdiscs gespeichert?,Wie sind Daten auf Laserdiscs ?,0.9832973
569,37515,Kann man eine Laserdisc als CD benutzen?,Kann  eine Laserdisc als CD benutzen?,0.988342
570,37516,Was bedeutet CAV bei Laserdiscs?,Was bedeutet  bei Laserdiscs?,0.92275685
571,37541,Welche Form der Erkenntnis steht dem Empirismus gegenüber?,Welche Form der Erkenntnis steht dem Empirismus ?,0.98923457
572,37544,Wieso lehnt Leibniz empirisches WIssen ab?, lehnt Leibniz empirisches WIssen ab?,0.98557234
573,37548,Wie wird nach Descartes Erkenntnis generiert?,Wie wird nach Descartes Erkenntnis ?,0.977408
574,37618,Wie ist das VErhältnis von Zonenzeit und Sonnenzeit?,Wie ist das VErhältnis  Zonenzeit und Sonnenzeit?,0.9897967
575,37621,Was ist die MEZ?,Was  die MEZ?,0.9719302
576,37632,Was ist die Sommerzeit?,Was ist  Sommerzeit?,0.98270136
577,37634,Was waren die Gründe für die Einführung der Sommerzeit?,Was waren  Gründe für  Einführung der Sommerzeit?,0.9878318
578,37637,Wieso galt in der Tschechoslowakei 1946 eine Winterzeit?,Wieso galt in  Tschechoslowakei 1946 eine Winterzeit?,0.9963114
579,37640,Was ist die Standardzeit?, ist die Standardzeit?,0.94313955
580,37606,Was ist die Sonnenzeit?,Was  die Sonnenzeit?,0.9728672
581,37609,Wann wurden die globalen Zeitzonen festgelegt?,Wann  die globalen Zeitzonen festgelegt?,0.9800553
582,37610,Wo wurde ein weltweites Zeitsystem festgelegt?,Wo wurde  weltweites Zeitsystem festgelegt?,0.98713064
583,37613,Was ist die Zonenzeit?,Was ist die ?,0.9075364
584,37614,Wie groß ist der Zeitunterschied zwischen den Zonenzeiten?,Wie groß  der Zeitunterschied zwischen den Zonenzeiten?,0.9926364
585,37722,Was war die erste Funktion von Hunden für den Menschen?,Was war die  Funktion von Hunden für den Menschen?,0.99180347
586,37723,von wem stammen Hunde ab?, wem stammen Hunde ab?,0.9658817
587,37724,Welche Eigenschaft benötigen Hunde für die Treibjagd?,Welche Eigenschaft benötigen  für die Treibjagd?,0.97626156
588,37725,Wozu wurden Dackel gezüchtet?,Wozu wurden Dackel ?,0.92666256
589,38381,Was trug bei der Kolonialisierung Amerikas durch die Europäer neben Krieg auch zur Ausschlöschung der indigenen Bevölkerung bei?,Was trug bei der Kolonialisierung Amerikas durch die Europäer neben  auch zur Ausschlöschung der indigenen Bevölkerung bei?,0.9957798
590,38490,Was wird heute in Bezug auf die Kolonisierung Amerikas als Mythos bezeichnet?,Was wird heute in Bezug auf die Kolonisierung  als Mythos bezeichnet?,0.99567056
591,38491,Auf wie viele Einwohner wird Mittelamerika zur Zeit der Kolonisierung durch die Europäer geschätzt?,Auf wie viele Einwohner wird Mittelamerika zur Zeit  Kolonisierung durch die Europäer geschätzt?,0.99664176
592,38492,Wer vernichtete die Azteken?, vernichtete die Azteken?,0.96017194
593,38493,Wie viele Soldaten hatte Hernan Cortes?,Wie  Soldaten hatte Hernan Cortes?,0.9834837
