,id,questions,questions_perturbed,similarity_scores
0,40369,Was kann den Verschleiß des seillosen Aufzuges minimieren?,Was  den Verschleiß des seillosen Aufzuges minimieren?,0.98502135
1,40370,In welcher deutschen Stadt wird der seillose Aufzug getestet?,In  deutschen Stadt wird der seillose Aufzug getestet?,0.9775136
2,40366,Wo wurde ein seilloser Aufzug entwickelt?,Wo wurde ein  Aufzug entwickelt?,0.97858626
3,40367,Wie funktioniert ein seilloser Aufzug?,Wie  ein seilloser Aufzug?,0.96229875
4,40368,Wann muss man die Zieletage in seillosen Aufzügen auswählen? ,Wann muss man  Zieletage in seillosen Aufzügen auswählen? ,0.9960887
5,40372,Was wird in Sichuan angebaut?,Was  in Sichuan angebaut?,0.96572715
6,40373,Welches für den Export bestimmte Produkt wird in Sichuan produziert?,Welches  den Export bestimmte Produkt wird in Sichuan produziert?,0.98894966
7,40374,Was wird in den Gebirgen von Sichuan gezüchtet?,Was wird in den Gebirgen von  gezüchtet?,0.99063647
8,40375,Welche tierische Produkte werden in Sichuan produziert?,Welche tierische Produkte werden in Sichuan ?,0.9881612
9,40376,"Was passiert, wenn die Polarisation einer Empfangs- und Sendeantenne nicht übereinstimmen?","Was passiert, wenn die Polarisation einer Empfangs- und  nicht übereinstimmen?",0.97820526
10,40377,Was wird von Antennen abgestrahlt?, wird von Antennen abgestrahlt?,0.9418248
11,40378,Wie bewegt sich der elektrische Feldvektor einer Antenne?,Wie bewegt sich der elektrische Feldvektor  Antenne?,0.9889905
12,40379,Was ist eine Wendelantenne?, ist eine Wendelantenne?,0.9674822
13,40436,Was ist das Hauptziel von Softwaretest?, ist das Hauptziel von Softwaretest?,0.96658564
14,40437,Wozu tragen die Ergebnisse von Softwaretests bei?, tragen die Ergebnisse von Softwaretests bei?,0.9603654
15,40477,Warum konnte man die Tuberkulose bis zum 19. Jahrhundert von anderen ähnlichen Krankheiten nicht unterscheiden?,Warum konnte man  Tuberkulose bis zum 19. Jahrhundert von anderen ähnlichen Krankheiten nicht unterscheiden?,0.9986026
16,40479,"Wer hat erfahren, dass die Tuberkulose nicht nur Lungen beschädigen kann, sondern auch andere Organe?","Wer hat erfahren,  die Tuberkulose nicht nur Lungen beschädigen kann, sondern auch andere Organe?",0.9951952
17,40487,"Wie hat man am Ende des 19. Jahrhundert in Großbritannien versucht, die Tuberkulose zu bekämpfen?"," hat man am Ende des 19. Jahrhundert in Großbritannien versucht, die Tuberkulose zu bekämpfen?",0.975617
18,40488,Was bedeutet die Pneumothorax-Technik bzw. Pneumolyse?,Was bedeutet die Pneumothorax- bzw. Pneumolyse?,0.99484193
19,40489,Wer hat zuerst die Resektion der Lungenabschnitte bei Tuberkulose ausgeführt?,Wer hat zuerst  Resektion der Lungenabschnitte bei Tuberkulose ausgeführt?,0.9968519
20,40490,"Wer hat das Bakterium, das die Tuberkulose auslöst, zuerst beschrieben?","Wer hat das Bakterium, das die Tuberkulose auslöst,  beschrieben?",0.99513054
21,40491,Welchen Preis gewann Robert Koch für die Entdeckung des Erregers von Tuberkulose?,Welchen Preis gewann Robert Koch für  Entdeckung des Erregers von Tuberkulose?,0.9983247
22,40492,Was führte zur Entwicklung des ersten Tuberkulose-Testes?,Was führte zur  des ersten Tuberkulose-Testes?,0.9930821
23,40493,Welche Diät kann bei der Behandlung der Hauttuberkulose helfen?,Welche Diät kann bei der Behandlung der  helfen?,0.95370835
24,40498,Wo spielte der FC Barcelona bei dessen Gründung?,Wo spielte der FC Barcelona bei  Gründung?,0.99371696
25,40499,Was war das erste Stadion des FC Barcelona?,Was war  erste Stadion des FC Barcelona?,0.9930174
26,40500,Wo fand das erste Spiel des FC Barcelona statt?,Wo fand das erste Spiel des FC Barcelona ?,0.97926474
27,40501,Was war die erste Spielstätte des FC Barcelona?,Was war die erste Spielstätte des FC ?,0.9936784
28,40502,Wie viele Fans passten in das erste Stadion des FC Bareclona?, viele Fans passten in das erste Stadion des FC Bareclona?,0.9882637
29,40503,Wie lange dauerte der Bau des Camp de Les Corts,Wie lange  der Bau des Camp de Les Corts,0.9802198
30,40511,In welchem weiteren Museums Haus hat Frida Kahlo abgesehen Vom Museo Frida Kahlo gewohnt?,In welchem weiteren Museums Haus hat  Kahlo abgesehen Vom Museo  Kahlo gewohnt?,0.9928971
31,40506,Wo in Mexiko-Stadt ist das Museo Frida Kahlo?,Wo in Mexiko-Stadt ist  Museo Frida Kahlo?,0.99637794
32,40507,Welche Farbe hat das Museo Frida Kahlo?,Welche Farbe  das Museo Frida Kahlo?,0.99323606
33,40509,In welchem Stil ist das Museo Frida Kahlo gebaut?,In welchem Stil ist das  Frida Kahlo gebaut?,0.99500287
34,40510,Mit wem war Frida Kahlo verheiratet?,Mit  war Frida Kahlo verheiratet?,0.97083247
35,40535,Was waren die Hauptprobleme der Aggregat-4 Rakete?,Was  die Hauptprobleme der Aggregat-4 Rakete?,0.98891973
36,40536,Was waren die Hauptmotive für den Wettlauf ins All?,Was waren die Hauptmotive für  Wettlauf ins All?,0.99642146
37,40540,Wer ist der größte Rosinen Exporteur der Welt?,Wer  der größte Rosinen Exporteur der Welt?,0.98919433
38,40541,Welches Land ist der größte Safran Exporteur?, Land ist der größte Safran Exporteur?,0.97948843
39,40542,Wie viel Prozent des Irans werden für die Landwirtschaft benutzt?,Wie viel Prozent des Irans werden  die Landwirtschaft benutzt?,0.99207664
40,36767,Was tauschen Bakterien mit Sexpili untereinander aus?, tauschen Bakterien mit Sexpili untereinander aus?,0.9666841
41,36768,Wie können Bakterien auch ohne Sexpili DNA untereinander austauschen?,Wie können Bakterien auch ohne  DNA untereinander austauschen?,0.98794746
42,36789,Wie viele schwarze Menschen leben in Frankreich?,Wie viele  Menschen leben in Frankreich?,0.9855418
43,36790,Woher kommen die meisten Schwarzen Frankreichs?,Woher kommen die meisten  Frankreichs?,0.9885516
44,36798,Warum gab es in der französischen Regierung oft schwarze Minister?,Warum gab es in der französischen  oft schwarze Minister?,0.99097127
45,36799,Wo leben die meisten schwarzen in Frankreich?,Wo  die meisten schwarzen in Frankreich?,0.96274394
46,36800,Warum sind Schwarze aus Überseegebieten in Frankreich tendenziell besser integriert als Schwarze aus Schwarzafrika?,Warum sind Schwarze  Überseegebieten in Frankreich tendenziell besser integriert als Schwarze  Schwarzafrika?,0.9905289
47,36801,Wie viele Schwarze waren in der Fußballnationalmannschaft Frankreichs bei der WM 2006?,Wie viele Schwarze waren in der Fußballnationalmannschaft Frankreichs  der WM 2006?,0.99708027
48,36802,Wer wurde 2005 als schwarze Frau Ministerin in Frankreich?,Wer  2005 als schwarze Frau Ministerin in Frankreich?,0.98617357
49,41037,Was ist die beste Schweizer Fußball Liga?,Was ist die  Schweizer Fußball Liga?,0.95905924
50,41044,Was ist der größte Leichtathletik Verein der Schweiz?,Was  der größte Leichtathletik Verein der Schweiz?,0.98878527
51,37175,In welcher Eritreischen Stadt Produziert Tesinma Busse?,In welcher Eritreischen Stadt Produziert  Busse?,0.98091716
52,41049,Welche Voraussetzung muss der Staatspräsident von Zypern erfüllen?,Welche Voraussetzung muss der  von Zypern erfüllen?,0.97538644
53,41047,Wer ist das Staatsoberhaupt von Zypern?,Wer ist das Staatsoberhaupt von ?,0.9722207
54,41051,Wie lange ist die Amtsperiode des zypriotischen Staatspräsidenten?,Wie lange ist die Amtsperiode  zypriotischen Staatspräsidenten?,0.9946921
55,41052,Seit wann die ist das Amt des stellvertretenden Staatspräsidenten unbesetzt?,Seit wann die ist das Amt des stellvertretenden Staatspräsidenten ?,0.9777161
56,41053,Als was bezeichnete der Demokratieindex Zypern 2019?,Als  bezeichnete der Demokratieindex Zypern 2019?,0.96284276
57,41054,Wie heißt die große kommunistische Partei in Zypern?,Wie heißt die große kommunistische  in Zypern?,0.984315
58,41055,Wie viele Sitze gibt es im Parlament von zypern?,Wie  Sitze gibt es im Parlament von zypern?,0.9865137
59,41056,In welchen Ländern gibt es die Sommerzeit?,In  Ländern gibt es die Sommerzeit?,0.98098725
60,41046,In welcher Jahreszeit wird auf die Sommerzeit umgestellt?,In welcher Jahreszeit wird auf die  umgestellt?,0.96697277
61,41057,Wann beginnt die Sommerzeit?,Wann  die Sommerzeit?,0.9482581
62,41067,Woher kommt der Begriff Pestizid?,Woher kommt  Begriff Pestizid?,0.98481196
63,41105,Von welchem Land ist die Kultur der Tristan da Cunha Inseln stark beeinflusst?,Von  Land ist die Kultur der Tristan da Cunha Inseln stark beeinflusst?,0.97548527
64,41107,Wie viel Alkohol trinken die Bewohner der Inseln Tristan da Cunhas?,Wie viel Alkohol  die Bewohner der Inseln Tristan da Cunhas?,0.98661923
65,41111,Wie viele polnische Spielfilme über Chopin gibt es?,Wie viele polnische Spielfilme über Chopin  es?,0.972289
66,41115,Was sind die wichtigsten Abschnitt Maßeinheits Größen des Korans?,Was  die wichtigsten Abschnitt Maßeinheits Größen des Korans?,0.9862172
67,41116,Wofür ist die Einteilung des Korans in den Dschuz besonders praktisch?,Wofür ist die Einteilung des Korans in  Dschuz besonders praktisch?,0.99774575
68,41117,Wofür wird die Einteilung des Korans in 30 Teile beim Ramadan benutzt?,Wofür wird die Einteilung  Korans in 30 Teile beim Ramadan benutzt?,0.99803644
69,41118,An was erkennt man die einzelnen Unterteilungen des Korans?,An was erkennt man die einzelnen Unterteilungen des ?,0.9869855
70,41119,Was wird für die MP3 Kompression benutzt?,Was wird für die MP3  benutzt?,0.977905
71,41122,Welches Verfahren zur Daten Kompression von Musik an Computern wird am häufigsten benutzt?,Welches Verfahren zur Daten Kompression  Musik an Computern wird am häufigsten benutzt?,0.9966962
72,41123,Wo wurde das MP3 Verfahren entwickelt?,Wo wurde  MP3 Verfahren entwickelt?,0.98551685
73,41124,Wann liefen die letzten Patente für das MP3 Format aus?,Wann liefen die letzten Patente  das MP3 Format aus?,0.99317527
74,41133,Welches Land hatte die größte freiwillige Armee im zweiten Weltkrieg?,Welches Land hatte die größte  Armee im zweiten Weltkrieg?,0.9971817
75,41134,Wo wurde die indische Armee am Anfang des zweiten Weltkriegs eingesetzt?,Wo wurde die indische  am Anfang des zweiten Weltkriegs eingesetzt?,0.9945191
76,41135,Wer gründete die Indische Legion in Europa?,Wer gründete die Indische Legion in ?,0.9857738
77,41136,Wo hat Subhash Chandra Bose die Indische Nationale Armee gegründet?,Wo hat Subhash Chandra Bose  Indische Nationale Armee gegründet?,0.9948492
78,41137,Wie viele Soldaten in Indien wurden während des Zweiten Weltkriegs getötet?,Wie  Soldaten in Indien wurden während des Zweiten Weltkriegs getötet?,0.9880188
79,41131,Warum wollte Indien in den zweiten Weltkrieg eintreten?,Warum wollte Indien in den  Weltkrieg eintreten?,0.992226
80,41132,Wie viel Mann hatte die indische Armee zu Beginn des zweiten Weltkrieges?,Wie viel Mann hatte die indische Armee zu Beginn des zweiten ?,0.9936467
81,41186,Was kann die Lebensdauer einer Glühbirne verlängern?,Was  die Lebensdauer einer Glühbirne verlängern?,0.9851568
82,41187,Welche Lampen sind schwierig zu wechseln?,Welche Lampen sind schwierig zu ?,0.95668554
83,41192,Wie kann die USA einen neuen Bundesstaat aufnehmen? ,Wie kann die  einen neuen Bundesstaat aufnehmen? ,0.98811877
84,41205,Warum ist öffentliche Verkehrsmittel so beliebt in New York?,Warum  öffentliche Verkehrsmittel so beliebt in New York?,0.9912141
85,41202,In welche Teile ist das Straßennetz in Manhattan unterteilt?,In welche Teile ist  Straßennetz in Manhattan unterteilt?,0.99435866
86,41203,Welches Transportmittel benutzen die meisten Einwohner in New York?,Welches Transportmittel benutzen die meisten Einwohner in  York?,0.9952249
87,41204,Welches Transportmittel ist typisch für New York?,Welches Transportmittel  typisch für New York?,0.9868587
88,41211,Wie viele Menschen leben im südlichen Teil von Zypern?,Wie viele Menschen leben im südlichen Teil von ?,0.9899162
89,41214,Wie hoch ist der Migrantenanteil in Zypern?,Wie  ist der Migrantenanteil in Zypern?,0.9820703
90,41213,Wie viele Deutschen wohnen in Südzypern?,Wie viele  wohnen in Südzypern?,0.9910352
91,41215,Aus welchen Ländern kommen die meisten Migranten in Zypern?, welchen Ländern kommen die meisten Migranten in Zypern?,0.98274046
92,41219,Wie hängen Frequenz und Kapazität bei Kondensatoren zusammen?,Wie hängen Frequenz  Kapazität bei Kondensatoren zusammen?,0.9812597
93,41220,Wo wird ein Kondensator vorwiegend induktiv wirksam?,Wo  ein Kondensator vorwiegend induktiv wirksam?,0.9888584
94,41221,Als was wirkt der Kondensator bei höheren Frequenzen?,Als was wirkt der Kondensator  höheren Frequenzen?,0.98861533
95,41222,Welche Kondensatoren werden für Frequenzen um 100 MHz eingesetzt?,Welche Kondensatoren werden für Frequenzen um 100  eingesetzt?,0.99249834
96,41223,Für welchen Frequenzbereich sind Aluminium-Elektrolytkondensatoren wirksam?,Für welchen  sind Aluminium-Elektrolytkondensatoren wirksam?,0.986219
97,41224,Wieso werden verschiedene Arten von Kondensatoren kombiniert?, werden verschiedene Arten von Kondensatoren kombiniert?,0.97761565
98,41225,Was ist der Fachbegriff für die Gleichgewichtslinie beim Gletscher?,Was ist der  für die Gleichgewichtslinie beim Gletscher?,0.9727941
99,41226,Was wird als Gleichgewichtslinie eines Gletschers bezeichnet?,Was wird als Gleichgewichtslinie  Gletschers bezeichnet?,0.9928878
100,41228,Wie ist das Zehrgebiet des Gletschers definiert?,Wie ist das Zehrgebiet des  definiert?,0.97180265
101,41229,Wie heißt der Bereich oberhalb der Gleichgewichtslinie des Gletschers?,Wie heißt  Bereich oberhalb  Gleichgewichtslinie des Gletschers?,0.9813815
102,41227,Wie heißt der Bereich unterhalb der Gleichgewichtslinie des Gletschers?,Wie heißt der  unterhalb der Gleichgewichtslinie des Gletschers?,0.9887727
103,41230,Wie ist das Akkumulationsgebiet des Gletschers definiert?,Wie ist das Akkumulationsgebiet des  definiert?,0.98228467
104,41279,In welchem Edikt wurde im osmanischen Reich die Gleichheit aller Bürger formal festgeschrieben?,In welchem Edikt wurde im osmanischen Reich die  aller Bürger formal festgeschrieben?,0.99263823
105,41280,Wann wurde das Edikt von Gülhane erlassen?,Wann wurde das  von Gülhane erlassen?,0.97842836
106,41282,Wann wurde der Hatt-i Hümayun erlassen?,Wann wurde der Hatt-i Hümayun ?,0.9870274
107,41283,Wann wurde die griechische Bevölkerung aus dem Osmanischen Reich vertrieben?,Wann wurde die griechische Bevölkerung aus dem  Reich vertrieben?,0.9873117
108,41284,Welches Gesetz war Grundlage für den Genozid an den Armeniern im Osmanischen Reich?,Welches Gesetz  Grundlage für den Genozid an den Armeniern im Osmanischen Reich?,0.9905058
109,41288,Welche Gruppe mit nationalistischen Ideen erlangte in der Endphase des Osmanischen Reichs die Macht?,Welche Gruppe  nationalistischen Ideen erlangte in der Endphase des Osmanischen Reichs die Macht?,0.9967015
110,41290,Wie viele Kasus gibt es im Tschechischen?,Wie  Kasus gibt es im Tschechischen?,0.95996016
111,41292,Welche Genera gibt es im Tschechischen?,Welche Genera gibt es im ?,0.98456436
112,41293,Zwischen was wird im Tschechischen beim männlichen Genus unterschieden?,Zwischen was wird im Tschechischen beim männlichen  unterschieden?,0.98421943
113,41294,Welche Artikel gibt es im Tschechischen?,Welche Artikel  es im Tschechischen?,0.9663597
114,41296,Wann wurde ASCII eingeführt?,Wann wurde ASCII ?,0.9714259
115,41297,Wie viele Zeichen umfasst ASCII?,Wie viele  umfasst ASCII?,0.98624486
116,41299,Welche Buchstaben umfasst ASCII?,Welche  umfasst ASCII?,0.96258247
117,41301,Wie viele Steuerzeichen gibt es im ASCII-Code?,Wie  Steuerzeichen gibt es im ASCII-Code?,0.98392296
118,41349,Für wie viel Geld wurde Neymar zu Paris Saint Germain transferiert?,Für wie viel Geld wurde Neymar zu Paris Saint  transferiert?,0.99297816
119,41350,"In welcher Mannschaft spielte Ousman Dembélé, bevor er zu FC Barcelona gekommen ist?","In welcher Mannschaft spielte Ousman Dembélé, bevor er zu FC Barcelona  ist?",0.99748784
120,41364,"Welche Art von Kondensatoren wurden mit ""cm"" gemessen?"," Art von Kondensatoren wurden mit ""cm"" gemessen?",0.984373
121,41366,In welchem Jahr wurde die US-Army aufgestellt?,In  Jahr wurde die US-Army aufgestellt?,0.95920575
122,41367,Was sind die Aufgaben der US-Army?, sind die Aufgaben der US-Army?,0.9631876
123,41368,Welche Armeen der Welt haben mehr Mann als die US-Army?,Welche Armeen  Welt haben mehr Mann als die US-Army?,0.99261993
124,41369,In welchem Teil von China liegt Zhejiang?,In welchem Teil von China liegt ?,0.9675675
125,41370,Woran grenzt Zhejiang im Norden?,Woran  Zhejiang im Norden?,0.9782037
126,41372,Was liegt südlich von Zhejiang?,Was liegt südlich von ?,0.9423602
127,41373,In welche Zonen wird Zhejiang gegliedert?,In  Zonen wird Zhejiang gegliedert?,0.9782709
128,41374,Wie viel Prozent der Fläche von Zhejiang bilden Gebirge?,Wie viel Prozent der Fläche von  bilden Gebirge?,0.9748359
129,41375,Wie viele Bergketen hat Zhejiang?,Wie viele Bergketen  Zhejiang?,0.9858329
130,41376,Wie hoch ist der höchste Punkt in Zhejiang?,Wie hoch ist der  Punkt in Zhejiang?,0.9850552
131,41377,Was ist der höchste Punkt in Zhejiang?,Was ist der  Punkt in Zhejiang?,0.963992
132,41378,Welche Flüsse verlaufen in Zhejiang?,Welche Flüsse  in Zhejiang?,0.9836564
133,41379,Welche natürliche Seen gibt es in Zhejiang?,Welche natürliche Seen gibt es in ?,0.96208316
134,41380,Wie viele Inseln gibt es in Zhejiang?, viele Inseln gibt es in Zhejiang?,0.9808643
135,41391,Wie sieht die molekulare Struktur von Eis aus?,Wie  die molekulare Struktur von Eis aus?,0.9813475
136,41392,In welchem Fall bewegt sich die obere Gletscherschicht schneller als die darunterliegende?,In welchem Fall bewegt sich die obere Gletscherschicht schneller als die ?,0.9890407
137,41393,Warum ist die Fließgeschwindigkeit verschiedener Teile eines Gletschers nicht gleichmäßig?,Warum ist die Fließgeschwindigkeit verschiedener Teile eines Gletschers  gleichmäßig?,0.98121923
138,38513,In welchem Bundesstaat liegt Houston?,In welchem Bundesstaat  Houston?,0.9476998
139,38514,Wo liegt Houston?,Wo liegt ?,0.9435439
140,38515,Wie viel der Fläche von Houston besteht aus Wasser?,Wie  der Fläche von Houston besteht aus Wasser?,0.97865164
141,38516,In welchem County liegt Houston?,In welchem County  Houston?,0.94544387
142,38517,Wie heißt der Schifffahrtskanal in Houston?,Wie heißt der  in Houston?,0.92974955
143,38518,"Wie heißt der Fluss, der durch Houston fließt?","Wie heißt  Fluss,  durch Houston fließt?",0.94857234
144,38519,Wo mündet der Buffalo Bayou?,Wo mündet der Buffalo ?,0.97578114
145,41413,Wie heißt die Methode des Regenwassersammelns in Rajasthan?, heißt die Methode des Regenwassersammelns in Rajasthan?,0.969654
146,41415,"Was versteht man unter dem ""Johad""?","Was versteht man unter dem """"?",0.9706976
147,41417,Welches Ergebnis hat der Bau von Johads in Rajasthan?,Welches Ergebnis hat der  von Johads in Rajasthan?,0.9809945
148,41419,Was versuchen die Umweltorganisationen wie CSE in Indien zu verbessern?,Was versuchen  Umweltorganisationen wie CSE in Indien zu verbessern?,0.9982691
149,38624,Seit wann gibt es eine quelloffene Variante von Poseidon für AROS?,Seit wann gibt es eine quelloffene Variante von Poseidon  AROS?,0.99663645
150,38625,Ist USB mit Atari MINT benutzbar?, USB mit Atari MINT benutzbar?,0.9876666
151,38626,Welche USB-Versionen unterstützt Windows 10?,Welche USB-Versionen unterstützt Windows ?,0.9941072
152,38627,Kann man USB-Anschlüsse mit DOS benutzen?,Kann man -Anschlüsse mit DOS benutzen?,0.987899
153,41435,Wann fand die Premier League erstmals statt?,Wann fand die Premier League erstmals ?,0.98362565
154,41436,Wie viele Vereine spielten beim ersten Turnier der Premier League teil?,Wie viele Vereine spielten beim ersten Turnier der Premier  teil?,0.9948034
155,41437,Welcher Verein erzielte das erste Tor in der Premier League?,Welcher Verein erzielte das erste Tor in der Premier ?,0.9933071
156,41438,Seit wann spielten in der Premier League nur noch 20 Vereine?,Seit wann spielten in  Premier League nur noch 20 Vereine?,0.9971602
157,41439,Was forderte die FIFA in Bezug auf die Anzahl der Vereine in der Premier League?,Was forderte  FIFA in Bezug auf  Anzahl der Vereine in der Premier League?,0.9956913
158,41440,Welcher war der erste nicht-englische Verein in der Premier League?,Welcher war der erste nicht- Verein in der Premier League?,0.9895206
159,41441,Wie hieß die Premier League vor 2007 offiziell?,Wie hieß  Premier League vor 2007 offiziell?,0.99013674
160,41448,Welches Audioformat wird beim HDTV hauptsächlich verwendet?, Audioformat wird beim HDTV hauptsächlich verwendet?,0.9745626
161,41449,Welche Filme verfügen bei HDTV nicht über Mehrkanalton?,Welche Filme verfügen bei HDTV  über Mehrkanalton?,0.9929731
162,41531,Wie schwer ist ein Schlachtreifer Strauß?,Wie schwer ist  Schlachtreifer Strauß?,0.99414194
163,41532,Welchem anderen Fleisch ist das Straußenfleisch ähnlich?, anderen Fleisch ist das Straußenfleisch ähnlich?,0.9708345
164,41536,Wer benutzt den deutschen Fußballjargon hauptsächlich?, benutzt den deutschen Fußballjargon hauptsächlich?,0.95488316
165,41537,Welche Art von Sprache ist der Fußballjargon?,Welche Art  Sprache ist der Fußballjargon?,0.9909804
166,41538,"Was ist das ""Sommermärchen""","Was ist  ""Sommermärchen""",0.98632497
167,41539,Welche Länder nutzen den Begriff Soccer?,Welche  nutzen den Begriff Soccer?,0.9736227
168,41540,Wie viele Touristen schlafen jährlich in Bern?, viele Touristen schlafen jährlich in Bern?,0.95803756
169,41541,Wie viele Touristen in Bern kommen aus dem Ausland?,Wie viele Touristen in  kommen aus dem Ausland?,0.9839928
170,41542,Woher kommen die meisten ausländischen Touristen Berns?,Woher kommen die meisten  Touristen Berns?,0.9963066
171,41543,Wann kommen die meisten Touristen nach Bern?, kommen die meisten Touristen nach Bern?,0.96996087
172,41599,Wer bewertete die Leistung von England im ersten Weltkrieg?,Wer  die Leistung von England im ersten Weltkrieg?,0.9531858
173,41600,Wer war 1921 britischer Premierminister?,Wer war 1921  Premierminister?,0.98793364
174,41601,Seit wann hat England einen Generalstab?, wann hat England einen Generalstab?,0.9734492
175,41602,"Warum hat Lord Chatfield als ""Minister for Coordination of Defence"" keinen Erfolg?","Warum hat Lord Chatfield als ""Minister for Coordination of "" keinen Erfolg?",0.99655324
176,41603,Wer führte in England das Amt des Verteidigungsministers ein?,Wer führte in  das Amt des Verteidigungsministers ein?,0.98667026
177,41604,Welche britischen Ministerien wurden zum heutigen Verteidigungsministerium zusammengefasst?,Welche britischen  wurden zum heutigen Verteidigungsministerium zusammengefasst?,0.99044967
178,41606,In welcher Klimazone liegt Oklahoma City?,In welcher Klimazone liegt  City?,0.9487698
179,41607,Wann war der heißeste Tag in Oklahoma City?,Wann war der heißeste  in Oklahoma City?,0.9887234
180,41608,In welchem Monat regnet es in Oklahoma City im Schnitt am meisten?,In welchem Monat  es in Oklahoma City im Schnitt am meisten?,0.98102576
181,41609,Was war die kälteste gemessene Temperatur in Oklahoma City?,Was war die kälteste  Temperatur in Oklahoma City?,0.9913434
182,41610,Wie oft treten in Oklahoma City Tornados auf?,Wie oft treten in Oklahoma  Tornados auf?,0.99742675
183,41611,Seit wann ist Zypern EU-Mitglied?,Seit wann ist Zypern EU-?,0.96452034
184,41613,Welches Land erkennt Zypern nicht offiziell an?,Welches Land erkennt  nicht offiziell an?,0.98710567
185,41614,Seit wann gibt es den Euro in Zypern?,Seit  gibt es den Euro in Zypern?,0.97904986
186,41615,Welche Maßnahmen unternimmt die Türkei gegen Zypern?,Welche Maßnahmen unternimmt die  gegen Zypern?,0.9866926
187,41616,Wann war Zypern kurz vor dem Staatsbankrott?,Wann war Zypern kurz vor dem ?,0.9501585
188,41617,Wie viel Geld bekam Zypern von der EU um ein Staatsbankrott zu verhindern?,Wie viel Geld  Zypern von der EU um ein Staatsbankrott zu verhindern?,0.99397457
189,38628,Wie wurde der Zusammenschluss mehrerer Sippen bei den Slawen genannt?,Wie wurde der Zusammenschluss  Sippen bei den Slawen genannt?,0.9856732
190,38629,Wie war das Zusammenleben in der lokalen Gemeinschaft bei den Slawen organisiert?,Wie war das Zusammenleben in der lokalen  bei den Slawen organisiert?,0.99418193
191,38630,Welchen Stellenwert hatte die Ehe bei den Slawen?,Welchen Stellenwert hatte die Ehe  den Slawen?,0.9780645
192,38546,Wo würde das frühere Baktrien heutzutage liegen?,Wo würde das frühere  heutzutage liegen?,0.97474957
193,38550,Wo herrschten die Shunga um 100 v. Chr.?,Wo herrschten die Shunga um 100 v. .?,0.9861149
194,38973,Welche Religion favorisierten die Shunga um 100  v. Chr.?,Welche Religion favorisierten  Shunga um 100  v. Chr.?,0.9964056
195,38060,Wer darf wie viele Vertreter in den Inselrat von St. Helena schicken?,Wer  wie viele Vertreter in den Inselrat von St. Helena schicken?,0.9940177
196,42109,Wie viele Menschen leben in Eritrea?,Wie  Menschen leben in Eritrea?,0.97983927
197,42110,Warum ist in Eritrea ein starkes Bevölkerungswachstum zu beobachten?,Warum  in Eritrea ein starkes Bevölkerungswachstum zu beobachten?,0.99334294
198,42111,Wie soll nach Einschätzungen die Bevölkerung in Eritrea bis 2050 anwachsen?,Wie  nach Einschätzungen die Bevölkerung in Eritrea bis 2050 anwachsen?,0.9929434
199,38177,Wie viele Tonnen Bomben wurden von den USA während des Koreakrieges abgeworfen?,Wie viele Tonnen Bomben wurden  den USA während des Koreakrieges abgeworfen?,0.9974174
200,38206,Seit wann hat in Griechenland das Fernsehen nicht mehr die meisten Werbeeinnahmen? , wann hat in Griechenland das Fernsehen nicht mehr die meisten Werbeeinnahmen? ,0.9907699
201,38207,Wie ist die Pressefreiheit in Griechenland im Vergleich zu anderen Ländern?,Wie ist die Pressefreiheit in Griechenland im Vergleich zu anderen ?,0.9967853
